http://dbpedia.org/ontology/University,University,http://dbpedia.org/ontology/formationYear
http://dbpedia.org/resource/National_Centre_for_Excellence_in_the_Teaching_of_Mathematics,National Centre for Excellence in the Teaching of Mathematics,2006
http://dbpedia.org/resource/Royal_Australian_and_New_Zealand_College_of_Ophthalmologists,Royal Australian and New Zealand College of Ophthalmologists,2000
http://dbpedia.org/resource/Sabah_Theological_College,Sabah Theological College,1965
http://dbpedia.org/resource/State_Library_of_North_Carolina,State Library of North Carolina,1812
http://dbpedia.org/resource/Strathclyde_Law_School,Strathclyde Law School,2003
http://dbpedia.org/resource/United_States_Department_of_Justice_Civil_Rights_Division,United States Department of Justice Civil Rights Division,1957
http://dbpedia.org/resource/European_Securities_and_Markets_Authority,European Securities and Markets Authority,2011
http://dbpedia.org/resource/Institute_of_International_Relations_Prague,Institute of International Relations Prague,1957
http://dbpedia.org/resource/Van_Andel_Institute,Van Andel Institute,1996
http://dbpedia.org/resource/Chartered_Institute_of_Public_Finance_and_Accountancy,Chartered Institute of Public Finance and Accountancy,1885
http://dbpedia.org/resource/Cincinnati_Conservatory_of_Music,Cincinnati Conservatory of Music,1867
http://dbpedia.org/resource/Instituto_de_Antropología_e_Historia,Instituto de Antropología e Historia,1946
http://dbpedia.org/resource/Institute_of_the_Regions_of_Europe,Institute of the Regions of Europe,2004
http://dbpedia.org/resource/Canadian_Global_Affairs_Institute,Canadian Global Affairs Institute,2001
http://dbpedia.org/resource/Acoustics_Research_Institute,Acoustics Research Institute,1972
http://dbpedia.org/resource/China_Institute_of_International_Studies,China Institute of International Studies,1956
http://dbpedia.org/resource/Cowles_Foundation,Cowles Foundation,1932
http://dbpedia.org/resource/Institute_of_Asian_Research,Institute of Asian Research,1978
http://dbpedia.org/resource/Max_Planck_Institute_for_Solar_System_Research,Max Planck Institute for Solar System Research,2004
http://dbpedia.org/resource/National_Bureau_of_Asian_Research,National Bureau of Asian Research,1989
http://dbpedia.org/resource/IFREMER,IFREMER,1984
http://dbpedia.org/resource/Institute_of_Standards_and_Industrial_Research_of_Iran,Institute of Standards and Industrial Research of Iran,1960
http://dbpedia.org/resource/International_Centre_of_Insect_Physiology_and_Ecology,International Centre of Insect Physiology and Ecology,1970
http://dbpedia.org/resource/Scion_(Crown_Research_Institute),Scion (Crown Research Institute),1947
http://dbpedia.org/resource/Presidency_of_Religious_Affairs,Presidency of Religious Affairs,1924
http://dbpedia.org/resource/Royal_Canadian_Academy_of_Arts,Royal Canadian Academy of Arts,1880
http://dbpedia.org/resource/The_Hastings_Center,The Hastings Center,1969
http://dbpedia.org/resource/Akademio_Literatura_de_Esperanto,Akademio Literatura de Esperanto,2008
http://dbpedia.org/resource/Bureau_of_STAGS,Bureau of STAGS,1993
http://dbpedia.org/resource/Center_for_Advanced_Materials,Center for Advanced Materials,2002
http://dbpedia.org/resource/Charlottetown_Yacht_Club,Charlottetown Yacht Club,1922
http://dbpedia.org/resource/Geological_Survey_of_Slovenia,Geological Survey of Slovenia,1946
http://dbpedia.org/resource/Health_Insurance_Fund_of_Macedonia,Health Insurance Fund of Macedonia,2000
http://dbpedia.org/resource/IDS_–_Institute_of_German_Language,IDS – Institute of German Language,1964
http://dbpedia.org/resource/IfM_–_Small_and_Medium_Sized_Companies_and_Entrepreneurship,IfM – Small and Medium Sized Companies and Entrepreneurship,1987
http://dbpedia.org/resource/Institute_for_Stem_Cell_Biology_and_Regenerative_Medicine,Institute for Stem Cell Biology and Regenerative Medicine,2009
http://dbpedia.org/resource/Iqbal_Academy_Pakistan,Iqbal Academy Pakistan,1951
http://dbpedia.org/resource/MAZEM_–_Mannheim_Center_for_Empirical_Multilingual_Research,MAZEM – Mannheim Center for Empirical Multilingual Research,2011
http://dbpedia.org/resource/Mannheim_Centre_for_Competition_and_Innovation,Mannheim Centre for Competition and Innovation,2008
http://dbpedia.org/resource/Municipal_Conservatory_of_Guarulhos,Municipal Conservatory of Guarulhos,1961
http://dbpedia.org/resource/Otto-Selz-Institute_of_Applied_Psychology,Otto-Selz-Institute of Applied Psychology,1964
http://dbpedia.org/resource/Serviço_Social_do_Comércio,Serviço Social do Comércio,1946
http://dbpedia.org/resource/Turkish_Revenue_Administration,Turkish Revenue Administration,2005
http://dbpedia.org/resource/Center_for_Jewish-Christian_Understanding_and_Cooperation,Center for Jewish-Christian Understanding and Cooperation,2008
http://dbpedia.org/resource/Cleveland_Institution_of_Engineers,Cleveland Institution of Engineers,1864
http://dbpedia.org/resource/Federal_Biomedical_Agency,Federal Biomedical Agency,1991
http://dbpedia.org/resource/Glory_Entertainment_(The_Association_of_Tehran_Young_Voice_Actors),Glory Entertainment (The Association of Tehran Young Voice Actors),2005
http://dbpedia.org/resource/Hogar_de_Cristo,Hogar de Cristo,1944
http://dbpedia.org/resource/Moscow_children's_ecological_and_biological_center,Moscow children's ecological and biological center,1960
http://dbpedia.org/resource/Schools_Association_for_Formal_Education,Schools Association for Formal Education,1998
http://dbpedia.org/resource/Jamiat_Kheir,Jamiat Kheir,1901
http://dbpedia.org/resource/Ahnenerbe,Ahnenerbe,1935
http://dbpedia.org/resource/Greater_Manchester_Integrated_Transport_Authority,Greater Manchester Integrated Transport Authority,1986
http://dbpedia.org/resource/National_Information_Technology_Development_Agency,National Information Technology Development Agency,2001
