http://dbpedia.org/ontology/University,University,http://dbpedia.org/ontology/formationYear
http://dbpedia.org/resource/International_Development_Association,International Development Association,1960
http://dbpedia.org/resource/International_Finance_Corporation,International Finance Corporation,1956
http://dbpedia.org/resource/Institute_of_Policy_Studies_(Sri_Lanka),Institute of Policy Studies (Sri Lanka),1988
http://dbpedia.org/resource/Intellectual_Property_Organisation_of_Pakistan,Intellectual Property Organisation of Pakistan,2005
http://dbpedia.org/resource/Leo_Baeck_Institute,Leo Baeck Institute,1955
http://dbpedia.org/resource/National_Institute_of_Polar_Research_(Japan),National Institute of Polar Research (Japan),1973
http://dbpedia.org/resource/Netherlands_Institute_for_Neuroscience,Netherlands Institute for Neuroscience,2005
http://dbpedia.org/resource/Instituto_Hondureño_de_Antropología_e_Historia,Instituto Hondureño de Antropología e Historia,1952
http://dbpedia.org/resource/Conservatoire_de_musique_du_Québec_à_Montréal,Conservatoire de musique du Québec à Montréal,1943
http://dbpedia.org/resource/Indian_Pharmacopoeia_Commission,Indian Pharmacopoeia Commission,1945
http://dbpedia.org/resource/Institute_for_Quantum_Optics_and_Quantum_Information,Institute for Quantum Optics and Quantum Information,2003
http://dbpedia.org/resource/Monash_Institute_of_Medical_Research,Monash Institute of Medical Research,1991
http://dbpedia.org/resource/National_Agency_of_Ukraine_on_Civil_Service,National Agency of Ukraine on Civil Service,1994
http://dbpedia.org/resource/National_Institute_for_Japanese_Language_and_Linguistics,National Institute for Japanese Language and Linguistics,1948
http://dbpedia.org/resource/Norwegian_Social_Research,Norwegian Social Research,1996
http://dbpedia.org/resource/Statistics_Iceland,Statistics Iceland,1914
http://dbpedia.org/resource/Royal_Australasian_College_of_Medical_Administrators,Royal Australasian College of Medical Administrators,1967
http://dbpedia.org/resource/Alexander_von_Humboldt_Biological_Resources_Research_Institute,Alexander von Humboldt Biological Resources Research Institute,1993
http://dbpedia.org/resource/Ilmin_International_Relations_Institute,Ilmin International Relations Institute,1995
http://dbpedia.org/resource/Sinchi_Amazonic_Institute_of_Scientific_Research,Sinchi Amazonic Institute of Scientific Research,1993
http://dbpedia.org/resource/National_Audit_Office_(China),National Audit Office (China),1983
http://dbpedia.org/resource/Polish_Institute_of_Arts_and_Sciences_of_America,Polish Institute of Arts and Sciences of America,1942
http://dbpedia.org/resource/Spanish_National_Research_Council,Spanish National Research Council,1939
http://dbpedia.org/resource/Adrian_Dominican_Sisters,Adrian Dominican Sisters,1923
http://dbpedia.org/resource/Adrian_Dominican_Sisters,Adrian Dominican Sisters,1944
http://dbpedia.org/resource/Al-Mawrid,Al-Mawrid,1983
http://dbpedia.org/resource/Human_Rights_Commission_(New_Zealand),Human Rights Commission (New Zealand),1977
http://dbpedia.org/resource/Institute_for_the_Study_of_Labor,Institute for the Study of Labor,1998
"http://dbpedia.org/resource/Institute_of_Materials,_Minerals_and_Mining","Institute of Materials, Minerals and Mining",2002
http://dbpedia.org/resource/International_Centre_for_Integrated_Mountain_Development,International Centre for Integrated Mountain Development,1983
http://dbpedia.org/resource/Max_Planck_Institute_for_Terrestrial_Microbiology,Max Planck Institute for Terrestrial Microbiology,1991
http://dbpedia.org/resource/Protection_and_Guard_Service,Protection and Guard Service,1990
http://dbpedia.org/resource/Serviciul_de_Telecomunicații_Speciale,Serviciul de Telecomunicații Speciale,1992
http://dbpedia.org/resource/World_Agroforestry_Centre,World Agroforestry Centre,1978
http://dbpedia.org/resource/Columbian_Institute_for_the_Promotion_of_Arts_and_Sciences,Columbian Institute for the Promotion of Arts and Sciences,1816
http://dbpedia.org/resource/John_von_Neumann_Environmental_Research_Institute_of_the_Pacific,John von Neumann Environmental Research Institute of the Pacific,1993
http://dbpedia.org/resource/National_Fund_for_Development_Projects_(Colombia),National Fund for Development Projects (Colombia),1968
http://dbpedia.org/resource/National_Institute_on_Minority_Health_and_Health_Disparities,National Institute on Minority Health and Health Disparities,2000
http://dbpedia.org/resource/Washington_County_History_&_Landmarks_Foundation,Washington County History & Landmarks Foundation,1973
http://dbpedia.org/resource/World_Vegetable_Center,World Vegetable Center,1971
http://dbpedia.org/resource/Asian_Infrastructure_Investment_Bank,Asian Infrastructure Investment Bank,2015
http://dbpedia.org/resource/Asian_Infrastructure_Investment_Bank,Asian Infrastructure Investment Bank,2016
http://dbpedia.org/resource/Bible_Study_Fellowship,Bible Study Fellowship,1959
http://dbpedia.org/resource/Ernst_Strüngmann_Institute,Ernst Strüngmann Institute,2008
http://dbpedia.org/resource/Higher_Education_Academy,Higher Education Academy,2003
http://dbpedia.org/resource/Imperial_Society_of_Teachers_of_Dancing,Imperial Society of Teachers of Dancing,1904
http://dbpedia.org/resource/Institute_for_Fiscal_Studies,Institute for Fiscal Studies,1969
http://dbpedia.org/resource/Institute_for_Palestine_Studies,Institute for Palestine Studies,1963
http://dbpedia.org/resource/Institute_of_Modern_Politics,Institute of Modern Politics,2009
http://dbpedia.org/resource/Institution_of_Engineering_Designers,Institution of Engineering Designers,1945
http://dbpedia.org/resource/National_Institute_of_Mental_Health,National Institute of Mental Health,1949
http://dbpedia.org/resource/Babraham_Institute,Babraham Institute,1949
http://dbpedia.org/resource/Conservatoire_de_musique_du_Québec_à_Saguenay,Conservatoire de musique du Québec à Saguenay,1968
http://dbpedia.org/resource/National_Institute_for_Medical_Research,National Institute for Medical Research,1913
http://dbpedia.org/resource/Nobel_Foundation,Nobel Foundation,1900
http://dbpedia.org/resource/Supreme_Audit_Office_(Poland),Supreme Audit Office (Poland),1919
http://dbpedia.org/resource/ARNES,ARNES,1992
http://dbpedia.org/resource/National_Information_Technology_Agency,National Information Technology Agency,2008
http://dbpedia.org/resource/Office_of_the_Comptroller_General_of_Colombia,Office of the Comptroller General of Colombia,1923
http://dbpedia.org/resource/Plant_&_Food_Research,Plant & Food Research,2008
http://dbpedia.org/resource/European_Council,European Council,1961
http://dbpedia.org/resource/European_Council,European Council,2009
http://dbpedia.org/resource/Institute_of_National_Remembrance,Institute of National Remembrance,1998
http://dbpedia.org/resource/Casco_(Utrecht),Casco (Utrecht),1990
http://dbpedia.org/resource/National_Centre_for_Disease_Control,National Centre for Disease Control,1909
http://dbpedia.org/resource/National_Institute_of_Electronics_(Pakistan),National Institute of Electronics (Pakistan),1979
http://dbpedia.org/resource/Salesians_of_Don_Bosco,Salesians of Don Bosco,1859
http://dbpedia.org/resource/Oriental_Institute_in_Sarajevo,Oriental Institute in Sarajevo,1950
http://dbpedia.org/resource/Royal_Institute_of_Public_Administration,Royal Institute of Public Administration,1922
http://dbpedia.org/resource/Sons_of_the_Holy_Family,Sons of the Holy Family,1864
http://dbpedia.org/resource/Praemium_Erasmianum_Foundation,Praemium Erasmianum Foundation,1958
http://dbpedia.org/resource/Japan_Institute_for_National_Fundamentals,Japan Institute for National Fundamentals,2007
http://dbpedia.org/resource/Centre_for_Scientific_Research_into_Plant_Medicine,Centre for Scientific Research into Plant Medicine,1976
http://dbpedia.org/resource/TÜBİTAK_Defense_Industries_Research_and_Development_Institute,TÜBİTAK Defense Industries Research and Development Institute,1972
http://dbpedia.org/resource/Dhrupad_Kendra_Bhopal,Dhrupad Kendra Bhopal,1981
"http://dbpedia.org/resource/Islamia_School,_Kargil","Islamia School, Kargil",1953
http://dbpedia.org/resource/Sachkhoj_Academy,Sachkhoj Academy,1996
http://dbpedia.org/resource/American_Center_of_Oriental_Research,American Center of Oriental Research,1968
http://dbpedia.org/resource/Australian_Institute_of_Sport,Australian Institute of Sport,1981
http://dbpedia.org/resource/Chewonki_Foundation,Chewonki Foundation,1915
http://dbpedia.org/resource/Estonian_Internal_Security_Service,Estonian Internal Security Service,1920
http://dbpedia.org/resource/Yale_Debate_Association,Yale Debate Association,1908
http://dbpedia.org/resource/Accademia_Filarmonica_di_Bologna,Accademia Filarmonica di Bologna,1666
http://dbpedia.org/resource/Centre_for_Development_and_the_Environment,Centre for Development and the Environment,1984
http://dbpedia.org/resource/Finnish_Environment_Institute,Finnish Environment Institute,1995
http://dbpedia.org/resource/Maulana_Abul_Kalam_Azad_Institute_of_Asian_Studies,Maulana Abul Kalam Azad Institute of Asian Studies,1993
http://dbpedia.org/resource/Multilateral_Investment_Guarantee_Agency,Multilateral Investment Guarantee Agency,1988
http://dbpedia.org/resource/National_Museum_of_the_Philippines,National Museum of the Philippines,1901
http://dbpedia.org/resource/National_Transplant_Organization,National Transplant Organization,1989
http://dbpedia.org/resource/Prince_Alwaleed_Bin_Talal_Center_for_Muslim-Christian_Understanding,Prince Alwaleed Bin Talal Center for Muslim-Christian Understanding,1993
http://dbpedia.org/resource/Statistics_Finland,Statistics Finland,1865
http://dbpedia.org/resource/The_Stimson_Center,The Stimson Center,1989
http://dbpedia.org/resource/Mannheim_Centre_for_European_Social_Research,Mannheim Centre for European Social Research,1989
"http://dbpedia.org/resource/Arab_League_Educational,_Cultural_and_Scientific_Organization","Arab League Educational, Cultural and Scientific Organization",1970
http://dbpedia.org/resource/Association_of_University_Centers_on_Disabilities,Association of University Centers on Disabilities,1963
http://dbpedia.org/resource/Centro_de_Estudios_Conservacionistas,Centro de Estudios Conservacionistas,1981
http://dbpedia.org/resource/Conservatoire_de_musique_du_Québec_à_Québec,Conservatoire de musique du Québec à Québec,1944
http://dbpedia.org/resource/Conservatoire_de_musique_du_Québec_à_Trois-Rivières,Conservatoire de musique du Québec à Trois-Rivières,1964
http://dbpedia.org/resource/German_Institute_of_Food_Technologies,German Institute of Food Technologies,1983
http://dbpedia.org/resource/Institute_for_Health_Metrics_and_Evaluation,Institute for Health Metrics and Evaluation,2007
http://dbpedia.org/resource/Institute_for_National_Security_and_Counterterrorism,Institute for National Security and Counterterrorism,2003
http://dbpedia.org/resource/Institute_for_Spectroscopy_Russian_Academy_of_Sciences,Institute for Spectroscopy Russian Academy of Sciences,1968
http://dbpedia.org/resource/Istituto_Superiore_di_Sanità,Istituto Superiore di Sanità,1941
http://dbpedia.org/resource/Max_Planck_Institute_for_Comparative_Public_Law_and_International_Law,Max Planck Institute for Comparative Public Law and International Law,1924
http://dbpedia.org/resource/National_Institute_of_Kathak_Dance,National Institute of Kathak Dance,1964
http://dbpedia.org/resource/Sir_Ronald_Ross_Institute_of_Parasitology,Sir Ronald Ross Institute of Parasitology,1955
http://dbpedia.org/resource/TÜBİTAK_Space_Technologies_Research_Institute,TÜBİTAK Space Technologies Research Institute,1985
http://dbpedia.org/resource/Arthur_C._Clarke_Institute_for_Modern_Technologies,Arthur C. Clarke Institute for Modern Technologies,1984
http://dbpedia.org/resource/Centre_for_Metrology_and_Accreditation,Centre for Metrology and Accreditation,1991
http://dbpedia.org/resource/D&F_Academy,D&F Academy,2009
http://dbpedia.org/resource/Incubateur_Régional_d'Afrique_de_l'Ouest,Incubateur Régional d'Afrique de l'Ouest,2010
http://dbpedia.org/resource/Institute_Menezes_Braganza,Institute Menezes Braganza,1871
http://dbpedia.org/resource/LIRYC,LIRYC,2011
http://dbpedia.org/resource/Ministry_of_Foreign_Affairs_(Turkmenistan),Ministry of Foreign Affairs (Turkmenistan),1991
http://dbpedia.org/resource/National_Institute_for_Biotechnology_and_Genetic_Engineering,National Institute for Biotechnology and Genetic Engineering,1994
http://dbpedia.org/resource/PTV_Academy,PTV Academy,1988
http://dbpedia.org/resource/Regional_Government_of_Castile-La_Mancha,Regional Government of Castile-La Mancha,1982
http://dbpedia.org/resource/SIVU_des_Inforoutes_de_l'Ardèche,SIVU des Inforoutes de l'Ardèche,1995
http://dbpedia.org/resource/Simons_Institute_for_the_Theory_of_Computing,Simons Institute for the Theory of Computing,2012
http://dbpedia.org/resource/V._V._Giri_National_Labour_Institute,V. V. Giri National Labour Institute,1974
http://dbpedia.org/resource/Norwegian_Institute_of_Public_Health,Norwegian Institute of Public Health,1929
http://dbpedia.org/resource/Office_of_the_Inspector_General_of_Colombia,Office of the Inspector General of Colombia,1830
http://dbpedia.org/resource/Dalle_Molle_Institute_for_Semantic_and_Cognitive_Studies,Dalle Molle Institute for Semantic and Cognitive Studies,1972
http://dbpedia.org/resource/Royal_Institute_of_the_Albanian_Studies,Royal Institute of the Albanian Studies,1940
http://dbpedia.org/resource/International_Bank_for_Reconstruction_and_Development,International Bank for Reconstruction and Development,1945
http://dbpedia.org/resource/Court_of_Justice_of_the_European_Union,Court of Justice of the European Union,1952
http://dbpedia.org/resource/Industrial_Research_Limited,Industrial Research Limited,1992
http://dbpedia.org/resource/Institute_for_Scientific_Interchange,Institute for Scientific Interchange,1983
http://dbpedia.org/resource/Instituto_de_Astrofísica_de_Andalucía,Instituto de Astrofísica de Andalucía,1975
"http://dbpedia.org/resource/Loyola_Academy,_Secunderabad","Loyola Academy, Secunderabad",1976
http://dbpedia.org/resource/Ministry_of_Foreign_Affairs_(Russia),Ministry of Foreign Affairs (Russia),1549
http://dbpedia.org/resource/Ministry_of_Foreign_Affairs_(Vietnam),Ministry of Foreign Affairs (Vietnam),1945
http://dbpedia.org/resource/Pakistan_Science_Foundation,Pakistan Science Foundation,1973
http://dbpedia.org/resource/Sardar_Vallabhbhai_Patel_National_Police_Academy,Sardar Vallabhbhai Patel National Police Academy,1948
http://dbpedia.org/resource/Securities_and_Exchange_Commission_(Nigeria),Securities and Exchange Commission (Nigeria),1979
http://dbpedia.org/resource/International_Institute_for_Strategic_Studies,International Institute for Strategic Studies,1958
http://dbpedia.org/resource/Real_Academia_Española,Real Academia Española,1713
http://dbpedia.org/resource/Home_Team_Academy,Home Team Academy,2006
http://dbpedia.org/resource/Idiap_Research_Institute,Idiap Research Institute,1991
http://dbpedia.org/resource/Civil_Service_College_Singapore,Civil Service College Singapore,2001
http://dbpedia.org/resource/Conservative_Yeshiva,Conservative Yeshiva,1995
http://dbpedia.org/resource/European_Insurance_and_Occupational_Pensions_Authority,European Insurance and Occupational Pensions Authority,2011
http://dbpedia.org/resource/Hong_Kong_International_Arbitration_Centre,Hong Kong International Arbitration Centre,1985
"http://dbpedia.org/resource/Japan_Oil,_Gas_and_Metals_National_Corporation","Japan Oil, Gas and Metals National Corporation",2004
http://dbpedia.org/resource/Japan_Society_for_the_Promotion_of_Science,Japan Society for the Promotion of Science,1932
http://dbpedia.org/resource/Kollel_Ohr_Yosef,Kollel Ohr Yosef,2007
http://dbpedia.org/resource/Miss_University_of_Florida,Miss University of Florida,1950
http://dbpedia.org/resource/The_American_Assembly,The American Assembly,1950
http://dbpedia.org/resource/The_Finnish_Institute_of_International_Affairs,The Finnish Institute of International Affairs,1961
http://dbpedia.org/resource/UNESCO-UNEVOC,UNESCO-UNEVOC,2002
http://dbpedia.org/resource/Institute_for_Social_Anthropology,Institute for Social Anthropology,1961
http://dbpedia.org/resource/Kazakhstan_Institute_for_Strategic_Studies,Kazakhstan Institute for Strategic Studies,1993
http://dbpedia.org/resource/African_Development_Bank,African Development Bank,1964
http://dbpedia.org/resource/Commonwealth_Business_Council,Commonwealth Business Council,1997
http://dbpedia.org/resource/European_Court_of_Auditors,European Court of Auditors,1977
http://dbpedia.org/resource/Ghana_School_of_Law,Ghana School of Law,1958
http://dbpedia.org/resource/Interparliamentary_Assembly_on_Orthodoxy,Interparliamentary Assembly on Orthodoxy,1994
http://dbpedia.org/resource/Islamic_Development_Bank,Islamic Development Bank,1975
http://dbpedia.org/resource/National_Alien_Registration_Authority,National Alien Registration Authority,2000
http://dbpedia.org/resource/Neighborhood_Playhouse_School_of_the_Theatre,Neighborhood Playhouse School of the Theatre,1928
http://dbpedia.org/resource/Physikalisch-Technische_Bundesanstalt,Physikalisch-Technische Bundesanstalt,1887
http://dbpedia.org/resource/United_States_Institute_of_Peace,United States Institute of Peace,1984
http://dbpedia.org/resource/China_Securities_Regulatory_Commission,China Securities Regulatory Commission,1992
http://dbpedia.org/resource/Fred_Hutchinson_Cancer_Research_Center,Fred Hutchinson Cancer Research Center,1975
http://dbpedia.org/resource/Generalitat_de_Catalunya,Generalitat de Catalunya,1283
http://dbpedia.org/resource/Generalitat_de_Catalunya,Generalitat de Catalunya,1714
http://dbpedia.org/resource/Generalitat_de_Catalunya,Generalitat de Catalunya,1931
http://dbpedia.org/resource/Generalitat_de_Catalunya,Generalitat de Catalunya,1939
http://dbpedia.org/resource/Generalitat_de_Catalunya,Generalitat de Catalunya,1977
http://dbpedia.org/resource/International_Dance_Teachers_Association,International Dance Teachers Association,1903
http://dbpedia.org/resource/International_Dance_Teachers_Association,International Dance Teachers Association,1967
http://dbpedia.org/resource/Royal_Aeronautical_Society,Royal Aeronautical Society,1866
http://dbpedia.org/resource/National_Institute_of_Allergy_and_Infectious_Diseases,National Institute of Allergy and Infectious Diseases,1955
http://dbpedia.org/resource/Pirbright_Institute,Pirbright Institute,1987
http://dbpedia.org/resource/Sisters_of_the_Holy_Names_of_Jesus_and_Mary,Sisters of the Holy Names of Jesus and Mary,1843
http://dbpedia.org/resource/Stockholm_International_Peace_Research_Institute,Stockholm International Peace Research Institute,1966
http://dbpedia.org/resource/Australian_Human_Rights_Commission,Australian Human Rights Commission,1986
http://dbpedia.org/resource/Euskaltzaindia,Euskaltzaindia,1919
http://dbpedia.org/resource/International_Centre_for_Settlement_of_Investment_Disputes,International Centre for Settlement of Investment Disputes,1965
http://dbpedia.org/resource/Planning_Commission_(India),Planning Commission (India),1950
http://dbpedia.org/resource/Sisters_of_Charity_of_Leavenworth,Sisters of Charity of Leavenworth,1858
http://dbpedia.org/resource/Sisters_of_Charity_of_the_Blessed_Virgin_Mary,Sisters of Charity of the Blessed Virgin Mary,1833
http://dbpedia.org/resource/Chinese_Academy_of_Geological_Sciences,Chinese Academy of Geological Sciences,1956
http://dbpedia.org/resource/Danish_Court_Administration,Danish Court Administration,1999
http://dbpedia.org/resource/Florida_TaxWatch,Florida TaxWatch,1979
http://dbpedia.org/resource/National_Applied_Research_Laboratories,National Applied Research Laboratories,2003
http://dbpedia.org/resource/Terres_Inovia,Terres Inovia,2015
http://dbpedia.org/resource/CONADI,CONADI,1993
"http://dbpedia.org/resource/Department_of_Psychology,_University_of_Oslo","Department of Psychology, University of Oslo",1909
http://dbpedia.org/resource/Max_Planck_Institute_for_Comparative_and_International_Private_Law,Max Planck Institute for Comparative and International Private Law,1927
http://dbpedia.org/resource/Max_Planck_Institute_for_Meteorology,Max Planck Institute for Meteorology,1975
http://dbpedia.org/resource/Virtual_Planetary_Laboratory,Virtual Planetary Laboratory,2001
http://dbpedia.org/resource/The_Independent_Commission_for_Human_Rights,The Independent Commission for Human Rights,1993
http://dbpedia.org/resource/HortResearch,HortResearch,1992
"http://dbpedia.org/resource/Cultural_Heritage,_Handcrafts_and_Tourism_Organization","Cultural Heritage, Handcrafts and Tourism Organization",1985
http://dbpedia.org/resource/Research_and_Documentation_Center_in_Sarajevo,Research and Documentation Center in Sarajevo,1994
http://dbpedia.org/resource/Sisters_of_the_Infant_Jesus,Sisters of the Infant Jesus,1675
http://dbpedia.org/resource/All_India_Institute_of_Hygiene_and_Public_Health,All India Institute of Hygiene and Public Health,1932
http://dbpedia.org/resource/National_Centre_for_Human_Rights_(Jordan),National Centre for Human Rights (Jordan),2006
http://dbpedia.org/resource/Centre_for_Strategic_and_Diplomatic_Studies,Centre for Strategic and Diplomatic Studies,2014
http://dbpedia.org/resource/Academy_of_the_Arabic_Language_in_Israel,Academy of the Arabic Language in Israel,2007
http://dbpedia.org/resource/ASTRON,ASTRON,1949
http://dbpedia.org/resource/Institut_national_de_la_recherche_agronomique,Institut national de la recherche agronomique,1946
http://dbpedia.org/resource/Nigerian_Institute_of_Management,Nigerian Institute of Management,1961
http://dbpedia.org/resource/Fundación_Cerezales_Antonino_y_Cinia,Fundación Cerezales Antonino y Cinia,2008
http://dbpedia.org/resource/Ministry_of_Transport_and_Communications_(Lithuania),Ministry of Transport and Communications (Lithuania),0022
http://dbpedia.org/resource/Central_Policy_Research_Office,Central Policy Research Office,1981
"http://dbpedia.org/resource/Academic_Center_for_Education,_Culture_and_Research","Academic Center for Education, Culture and Research",1980
http://dbpedia.org/resource/Academy_of_Sciences_and_Arts_of_the_Republika_Srpska,Academy of Sciences and Arts of the Republika Srpska,1996
http://dbpedia.org/resource/American_Osteopathic_College_of_Occupational_&_Preventive_Medicine,American Osteopathic College of Occupational & Preventive Medicine,1979
http://dbpedia.org/resource/Borstal_Institute_for_Juveniles,Borstal Institute for Juveniles,2007
http://dbpedia.org/resource/Bosniak_Academy_of_Sciences_and_Arts,Bosniak Academy of Sciences and Arts,2011
http://dbpedia.org/resource/Institute_for_Culture_of_Croats_of_Vojvodina,Institute for Culture of Croats of Vojvodina,2008
http://dbpedia.org/resource/International_Anti-Corruption_Academy,International Anti-Corruption Academy,2011
http://dbpedia.org/resource/Jordan_Securities_Commission,Jordan Securities Commission,1997
http://dbpedia.org/resource/José_Benito_Vives_de_Andréis_Marine_and_Coastal_Research_Institute,José Benito Vives de Andréis Marine and Coastal Research Institute,1993
http://dbpedia.org/resource/Kerala_State_Civil_Supplies_Corporation,Kerala State Civil Supplies Corporation,1974
http://dbpedia.org/resource/MRC_Human_Nutrition_Research,MRC Human Nutrition Research,1998
http://dbpedia.org/resource/Max_Healthcare,Max Healthcare,2001
http://dbpedia.org/resource/Pacific_Forum_CSIS,Pacific Forum CSIS,1975
http://dbpedia.org/resource/Paul_Ehrlich_Institute,Paul Ehrlich Institute,1896
http://dbpedia.org/resource/Pope_Center,Pope Center,2003
http://dbpedia.org/resource/Prosvjeta,Prosvjeta,1944
http://dbpedia.org/resource/Securities_Depository_Center_(Jordan),Securities Depository Center (Jordan),1999
http://dbpedia.org/resource/Shriram_Bharatiya_Kala_Kendra,Shriram Bharatiya Kala Kendra,1952
http://dbpedia.org/resource/The_Cyprus_Institute_of_Neurology_and_Genetics,The Cyprus Institute of Neurology and Genetics,1990
http://dbpedia.org/resource/UK_Green_Investment_Bank,UK Green Investment Bank,2012
http://dbpedia.org/resource/National_Service_of_Learning_(Colombia),National Service of Learning (Colombia),1957
http://dbpedia.org/resource/Federal_Institute_for_Materials_Research_and_Testing,Federal Institute for Materials Research and Testing,1954
http://dbpedia.org/resource/American_College_of_Medical_Informatics,American College of Medical Informatics,1984
http://dbpedia.org/resource/American_Institute_for_Economic_Research,American Institute for Economic Research,1933
http://dbpedia.org/resource/Carmelite_Daughters_of_the_Divine_Heart_of_Jesus,Carmelite Daughters of the Divine Heart of Jesus,1891
http://dbpedia.org/resource/Commissioner_for_Human_Rights,Commissioner for Human Rights,1999
http://dbpedia.org/resource/East_Malling_Research_Station,East Malling Research Station,1913
http://dbpedia.org/resource/Georgia_Historical_Society,Georgia Historical Society,1839
http://dbpedia.org/resource/Ifo_Institute_for_Economic_Research,Ifo Institute for Economic Research,1949
http://dbpedia.org/resource/Institute_of_Cast_Metals_Engineers,Institute of Cast Metals Engineers,1904
http://dbpedia.org/resource/Institution_of_Agricultural_Engineers,Institution of Agricultural Engineers,1938
http://dbpedia.org/resource/Institution_of_Chemical_Engineers,Institution of Chemical Engineers,1922
http://dbpedia.org/resource/MRC_Mitochondrial_Biology_Unit,MRC Mitochondrial Biology Unit,1927
http://dbpedia.org/resource/Max_Planck_Institute_for_Coal_Research,Max Planck Institute for Coal Research,1912
http://dbpedia.org/resource/Max_Planck_Institute_of_Immunobiology_and_Epigenetics,Max Planck Institute of Immunobiology and Epigenetics,1961
