http://dbpedia.org/ontology/EducationalInstitution,EducationalInstitution,http://dbpedia.org/ontology/foundingYear
http://dbpedia.org/resource/Abercorn_School,Abercorn School,1747
"http://dbpedia.org/resource/King's_School,_Worcester","King's School, Worcester",1670
http://dbpedia.org/resource/Kingsburg_High_School,Kingsburg High School,1823
http://dbpedia.org/resource/Carlynton_School_District,Carlynton School District,1854
http://dbpedia.org/resource/Oratory_Preparatory_School,Oratory Preparatory School,1910
"http://dbpedia.org/resource/St._Paul’s_Girls_School,_Milagiriya","St. Paul’s Girls School, Milagiriya",2112
http://dbpedia.org/resource/Palmer's_College,Palmer's College,1869
http://dbpedia.org/resource/The_Deepings_School,The Deepings School,1787
http://dbpedia.org/resource/ACG_Strathallan,ACG Strathallan,1841
http://dbpedia.org/resource/Ardvreck_School,Ardvreck School,2009
http://dbpedia.org/resource/Bangpakok_Wittayakom_School,Bangpakok Wittayakom School,2121
http://dbpedia.org/resource/Liceum_Ogolnoksztalcace_im._K.E.N.,Liceum Ogolnoksztalcace im. K.E.N.,2025
http://dbpedia.org/resource/Tarpon_Springs_High_School,Tarpon Springs High School,2061
http://dbpedia.org/resource/Neuqua_Valley_High_School,Neuqua Valley High School,2224
http://dbpedia.org/resource/Abildsø_skole,Abildsø skole,1878
http://dbpedia.org/resource/Middletown_High_School_(Connecticut),Middletown High School (Connecticut),2231
http://dbpedia.org/resource/Lyneham_High_School,Lyneham High School,1922
http://dbpedia.org/resource/Hazelwood_West_High_School,Hazelwood West High School,2175
http://dbpedia.org/resource/Sri_Kuala_Lumpur,Sri Kuala Lumpur,2132
http://dbpedia.org/resource/Port_Huron_Northern_High_School,Port Huron Northern High School,1780
http://dbpedia.org/resource/William_E._Grady_CTE_High_School,William E. Grady CTE High School,1948
"http://dbpedia.org/resource/Guru_Harkrishan_Public_School,_Indore","Guru Harkrishan Public School, Indore",1865
http://dbpedia.org/resource/Braintree_High_School,Braintree High School,1935
http://dbpedia.org/resource/Des_Moines_Christian_School,Des Moines Christian School,1814
"http://dbpedia.org/resource/St._Augustine's_College,_Yarraville","St. Augustine's College, Yarraville",2081
"http://dbpedia.org/resource/Cardinal_Mooney_High_School_(Youngstown,_Ohio)","Cardinal Mooney High School (Youngstown, Ohio)",1824
http://dbpedia.org/resource/Lumen_Christi_Junior/Senior_High_School,Lumen Christi Junior/Senior High School,1797
http://dbpedia.org/resource/Jay_M._Robinson_High_School,Jay M. Robinson High School,2258
http://dbpedia.org/resource/Taikura_Rudolf_Steiner_School,Taikura Rudolf Steiner School,1809
http://dbpedia.org/resource/Nandua_High_School,Nandua High School,1899
http://dbpedia.org/resource/Los_Alamos_High_School,Los Alamos High School,1754
http://dbpedia.org/resource/Fort_Lauderdale_High_School,Fort Lauderdale High School,1810
http://dbpedia.org/resource/H._H._Ellis_Technical_High_School,H. H. Ellis Technical High School,1961
http://dbpedia.org/resource/Austin_Catholic_Preparatory_School,Austin Catholic Preparatory School,1815
http://dbpedia.org/resource/Meoncross_School,Meoncross School,1779
"http://dbpedia.org/resource/Cranbrook_School,_Ilford","Cranbrook School, Ilford",1900
http://dbpedia.org/resource/Hamilton_and_Alexandra_College,Hamilton and Alexandra College,1621
http://dbpedia.org/resource/Gerard_Redmond_Community_Catholic_School,Gerard Redmond Community Catholic School,1900
http://dbpedia.org/resource/Charles_Campbell_College,Charles Campbell College,1864
http://dbpedia.org/resource/Tecumseh_Junior_–_Senior_High_School,Tecumseh Junior – Senior High School,2210
http://dbpedia.org/resource/Cistercian_Preparatory_School,Cistercian Preparatory School,2169
http://dbpedia.org/resource/Cirencester_Kingshill_School,Cirencester Kingshill School,1747
http://dbpedia.org/resource/Wynberg_Boys'_High_School,Wynberg Boys' High School,1862
http://dbpedia.org/resource/Rastrick_High_School,Rastrick High School,2063
http://dbpedia.org/resource/Blackheath_High_School,Blackheath High School,2138
http://dbpedia.org/resource/Plantation_High_School,Plantation High School,1768
http://dbpedia.org/resource/Cheyenne_South_High_School,Cheyenne South High School,2177
http://dbpedia.org/resource/Our_Lady_of_Mount_Carmel_High_School_(Maryland),Our Lady of Mount Carmel High School (Maryland),2032
http://dbpedia.org/resource/The_Chantry_School,The Chantry School,1873
http://dbpedia.org/resource/Woodstock_High_School_(Georgia),Woodstock High School (Georgia),1727
"http://dbpedia.org/resource/Franklin_Delano_Roosevelt_High_School_(Hyde_Park,_New_York)","Franklin Delano Roosevelt High School (Hyde Park, New York)",1866
"http://dbpedia.org/resource/Foothill_High_School_(Henderson,_Nevada)","Foothill High School (Henderson, Nevada)",2126
http://dbpedia.org/resource/Geilston_Bay_High_School,Geilston Bay High School,1905
http://dbpedia.org/resource/Notre_Dame-Bishop_Gibbons_High_School,Notre Dame-Bishop Gibbons High School,2229
http://dbpedia.org/resource/Colonel_Brown_Cambridge_School,Colonel Brown Cambridge School,2057
http://dbpedia.org/resource/Montgomery_County_High_School_(Missouri),Montgomery County High School (Missouri),1719
"http://dbpedia.org/resource/Jefferson_Center_(Toledo,_Ohio)","Jefferson Center (Toledo, Ohio)",1758
http://dbpedia.org/resource/Australian_Ballet_School,Australian Ballet School,1912
"http://dbpedia.org/resource/Highlands_High_School_(Natrona_Heights,_Pennsylvania)","Highlands High School (Natrona Heights, Pennsylvania)",2097
http://dbpedia.org/resource/Taree_High_School,Taree High School,1635
http://dbpedia.org/resource/Smithtown_Christian_School,Smithtown Christian School,2142
http://dbpedia.org/resource/Deutsche_Schule_Lissabon,Deutsche Schule Lissabon,2024
http://dbpedia.org/resource/Sir_Bernard_Lovell_School,Sir Bernard Lovell School,1950
http://dbpedia.org/resource/Dalriada_School,Dalriada School,1992
http://dbpedia.org/resource/Lanai_High_and_Elementary_School,Lanai High and Elementary School,1852
http://dbpedia.org/resource/Northern_Valley_Regional_High_School_at_Old_Tappan,Northern Valley Regional High School at Old Tappan,1719
"http://dbpedia.org/resource/Jawahar_Navodaya_Vidyalaya,_Indore","Jawahar Navodaya Vidyalaya, Indore",1739
http://dbpedia.org/resource/Watkinson_School,Watkinson School,1660
http://dbpedia.org/resource/James_Madison_High_School_(Brooklyn),James Madison High School (Brooklyn),1955
"http://dbpedia.org/resource/Holy_Cross_School_(Salem,_India)","Holy Cross School (Salem, India)",2237
http://dbpedia.org/resource/Glenrothes_High_School,Glenrothes High School,2081
http://dbpedia.org/resource/Park_School_of_Baltimore,Park School of Baltimore,2119
http://dbpedia.org/resource/Lethbridge_School,Lethbridge School,1919
http://dbpedia.org/resource/M.A._Milam_K-8_Center,M.A. Milam K-8 Center,1941
http://dbpedia.org/resource/Tustin_High_School,Tustin High School,2111
http://dbpedia.org/resource/British_International_School_of_Boston,British International School of Boston,2084
http://dbpedia.org/resource/Vandalia_Christian_School,Vandalia Christian School,1746
"http://dbpedia.org/resource/Creekview_High_School_(Canton,_Georgia)","Creekview High School (Canton, Georgia)",1729
http://dbpedia.org/resource/Cypress_Bay_High_School,Cypress Bay High School,2215
http://dbpedia.org/resource/Chatham_High_School_(New_Jersey),Chatham High School (New Jersey),1920
http://dbpedia.org/resource/Del_Norte_High_School_(New_Mexico),Del Norte High School (New Mexico),1854
http://dbpedia.org/resource/Glyn_School,Glyn School,1816
http://dbpedia.org/resource/Downers_Grove_South_High_School,Downers Grove South High School,1671
http://dbpedia.org/resource/Nicholson_Catholic_College,Nicholson Catholic College,1851
http://dbpedia.org/resource/Berkeley_Carroll_School,Berkeley Carroll School,1876
http://dbpedia.org/resource/Tinago_National_High_School,Tinago National High School,2029
http://dbpedia.org/resource/Millburn_Academy,Millburn Academy,2015
http://dbpedia.org/resource/Brooklyn_Technical_High_School,Brooklyn Technical High School,1992
http://dbpedia.org/resource/Lancaster_Girls'_Grammar_School,Lancaster Girls' Grammar School,2020
http://dbpedia.org/resource/Kolej_Yayasan_Saad,Kolej Yayasan Saad,2273
http://dbpedia.org/resource/San_Andrea_School,San Andrea School,1743
http://dbpedia.org/resource/Chiniot_Islamia_School,Chiniot Islamia School,1861
http://dbpedia.org/resource/Richmond_High_School_(New_South_Wales),Richmond High School (New South Wales),1820
http://dbpedia.org/resource/St_Helen's_School,St Helen's School,1963
http://dbpedia.org/resource/North_Pocono_High_School,North Pocono High School,2007
http://dbpedia.org/resource/Collège-lycée_Ampère,Collège-lycée Ampère,1828
http://dbpedia.org/resource/Arsenal_Technical_High_School,Arsenal Technical High School,1814
http://dbpedia.org/resource/Effingham_County_High_School,Effingham County High School,1734
http://dbpedia.org/resource/Elanora_State_High_School,Elanora State High School,2120
http://dbpedia.org/resource/Tolworth_Girls'_School,Tolworth Girls' School,2184
http://dbpedia.org/resource/Otago_Girls'_High_School,Otago Girls' High School,1659
http://dbpedia.org/resource/The_Marches_School,The Marches School,1918
http://dbpedia.org/resource/SM_St_Joseph_Papar,SM St Joseph Papar,1937
http://dbpedia.org/resource/East_Linn_Christian_Academy,East Linn Christian Academy,1734
"http://dbpedia.org/resource/S._Thomas'_College,_Gurutalawa","S. Thomas' College, Gurutalawa",1776
http://dbpedia.org/resource/Niles_East_High_School,Niles East High School,1919
http://dbpedia.org/resource/Wheatland_High_School_(California),Wheatland High School (California),2176
http://dbpedia.org/resource/Clinton_Avenue_School,Clinton Avenue School,1990
"http://dbpedia.org/resource/Ballard_High_School_(Seattle,_Washington)","Ballard High School (Seattle, Washington)",1765
http://dbpedia.org/resource/Urrbrae_Agricultural_High_School,Urrbrae Agricultural High School,1691
http://dbpedia.org/resource/English_College_in_Prague,English College in Prague,2099
"http://dbpedia.org/resource/Christian_Brothers_College,_Cork","Christian Brothers College, Cork",2019
http://dbpedia.org/resource/The_Church_of_Christ_in_China_Ming_Yin_College,The Church of Christ in China Ming Yin College,2211
http://dbpedia.org/resource/Magnolia_High_School_(Texas),Magnolia High School (Texas),2063
http://dbpedia.org/resource/San_Antonio_Christian_Schools,San Antonio Christian Schools,2172
http://dbpedia.org/resource/Drayton_School,Drayton School,2040
http://dbpedia.org/resource/Norcross_High_School,Norcross High School,1739
http://dbpedia.org/resource/Macquarie_College,Macquarie College,2037
http://dbpedia.org/resource/Durham_High_School_(California),Durham High School (California),1860
http://dbpedia.org/resource/City_of_Leicester_College,City of Leicester College,1806
http://dbpedia.org/resource/Eastern_Technical_High_School,Eastern Technical High School,2218
http://dbpedia.org/resource/Tohono_O'odham_High_School,Tohono O'odham High School,1686
http://dbpedia.org/resource/Don_Bosco_Preparatory_High_School,Don Bosco Preparatory High School,1638
"http://dbpedia.org/resource/Columbia_High_School_(Nampa,_Idaho)","Columbia High School (Nampa, Idaho)",2257
http://dbpedia.org/resource/Lebanon_Catholic_High_School,Lebanon Catholic High School,1792
http://dbpedia.org/resource/Carey_Baptist_Grammar_School,Carey Baptist Grammar School,1902
http://dbpedia.org/resource/Garces_Memorial_High_School,Garces Memorial High School,1798
http://dbpedia.org/resource/Pompton_Lakes_High_School,Pompton Lakes High School,1739
http://dbpedia.org/resource/Bournemouth_Collegiate_School,Bournemouth Collegiate School,2030
http://dbpedia.org/resource/School_of_the_Holy_Child,School of the Holy Child,1764
http://dbpedia.org/resource/Joyce_Frankland_Academy,Joyce Frankland Academy,1353
"http://dbpedia.org/resource/Holland_Hall_(Tulsa,_Oklahoma)","Holland Hall (Tulsa, Oklahoma)",1814
http://dbpedia.org/resource/Central_Cabarrus_High_School,Central Cabarrus High School,1674
http://dbpedia.org/resource/Amador_Valley_High_School,Amador Valley High School,1649
http://dbpedia.org/resource/Argoed_High_School,Argoed High School,1801
http://dbpedia.org/resource/Benilde-St._Margaret's,Benilde-St. Margaret's,1929
http://dbpedia.org/resource/Lutheran_West,Lutheran West,1955
http://dbpedia.org/resource/Van_Nuys_High_School,Van Nuys High School,2177
http://dbpedia.org/resource/Valley_New_School,Valley New School,1786
"http://dbpedia.org/resource/St_Fidelis_College,_Lucknow","St Fidelis College, Lucknow",2032
"http://dbpedia.org/resource/DeSales_High_School_(Geneva,_New_York)","DeSales High School (Geneva, New York)",1953
http://dbpedia.org/resource/Halifax_Grammar_School,Halifax Grammar School,1952
http://dbpedia.org/resource/Scholars_Online,Scholars Online,1762
http://dbpedia.org/resource/Berlin_High_School_(Connecticut),Berlin High School (Connecticut),2035
http://dbpedia.org/resource/Lundsbergs_boarding_school,Lundsbergs boarding school,2175
"http://dbpedia.org/resource/Yeshivah_College,_Australia","Yeshivah College, Australia",1967
http://dbpedia.org/resource/Wichita_Heights_High_School,Wichita Heights High School,1935
http://dbpedia.org/resource/Arlington_Catholic_High_School,Arlington Catholic High School,1712
http://dbpedia.org/resource/Carmel_Pak_U_Secondary_School,Carmel Pak U Secondary School,2026
http://dbpedia.org/resource/Earl_Warren_High_School,Earl Warren High School,1991
http://dbpedia.org/resource/Mountain_View_High_School_(Virginia),Mountain View High School (Virginia),2242
http://dbpedia.org/resource/Prout_School,Prout School,2139
http://dbpedia.org/resource/Manchester_Grammar_School,Manchester Grammar School,1421
http://dbpedia.org/resource/Westminster_Under_School,Westminster Under School,1758
http://dbpedia.org/resource/Gymnasium_9_(Simferopol),Gymnasium 9 (Simferopol),1638
http://dbpedia.org/resource/Chio_Min_Secondary_School,Chio Min Secondary School,1678
http://dbpedia.org/resource/Whitmer_High_School,Whitmer High School,1877
http://dbpedia.org/resource/Gateway_High_School_(Zimbabwe),Gateway High School (Zimbabwe),2225
http://dbpedia.org/resource/Indian_Mountain_School,Indian Mountain School,1861
http://dbpedia.org/resource/Hampshire_High_School_(West_Virginia),Hampshire High School (West Virginia),2155
http://dbpedia.org/resource/James_Hubert_Blake_High_School,James Hubert Blake High School,2115
http://dbpedia.org/resource/Daeil_Foreign_Language_High_School,Daeil Foreign Language High School,2070
http://dbpedia.org/resource/Francisco_P._Felix_Memorial_National_High_School,Francisco P. Felix Memorial National High School,2068
http://dbpedia.org/resource/Spectrum_Community_School_(British_Columbia),Spectrum Community School (British Columbia),2062
http://dbpedia.org/resource/Pobalscoil_Ghaoth_Dobhair,Pobalscoil Ghaoth Dobhair,2235
http://dbpedia.org/resource/Geneva_High_School_(Illinois),Geneva High School (Illinois),2018
http://dbpedia.org/resource/Bearden_High_School_(Tennessee),Bearden High School (Tennessee),1713
http://dbpedia.org/resource/Mentor_High_School,Mentor High School,1913
http://dbpedia.org/resource/Fitch_Senior_High_School,Fitch Senior High School,1993
http://dbpedia.org/resource/Marlton_School,Marlton School,2190
http://dbpedia.org/resource/Ditcham_Park_School,Ditcham Park School,1889
http://dbpedia.org/resource/Notre_Dame_Catholic_High_School_(Connecticut),Notre Dame Catholic High School (Connecticut),1813
http://dbpedia.org/resource/Westminster_School_(Connecticut),Westminster School (Connecticut),1962
http://dbpedia.org/resource/Northern_Highlands_Regional_High_School,Northern Highlands Regional High School,2184
http://dbpedia.org/resource/Welham_Boys'_School,Welham Boys' School,1682
http://dbpedia.org/resource/Kermit_Independent_School_District,Kermit Independent School District,1937
http://dbpedia.org/resource/Michael_Mount_Waldorf_School,Michael Mount Waldorf School,1672
http://dbpedia.org/resource/Cypress_Ridge_High_School,Cypress Ridge High School,1907
http://dbpedia.org/resource/Sydney_Film_School,Sydney Film School,2083
"http://dbpedia.org/resource/The_Mount_School,_Mill_Hill","The Mount School, Mill Hill",2029
http://dbpedia.org/resource/Churston_Ferrers_Grammar_School,Churston Ferrers Grammar School,1782
http://dbpedia.org/resource/Maumee_Valley_Country_Day_School,Maumee Valley Country Day School,2051
http://dbpedia.org/resource/Mount_View_High_School_(Maine),Mount View High School (Maine),1983
"http://dbpedia.org/resource/Collingwood_College,_Victoria","Collingwood College, Victoria",1810
http://dbpedia.org/resource/Fairdale_High_School,Fairdale High School,2123
http://dbpedia.org/resource/Thomas_Jefferson_Independent_Day_School,Thomas Jefferson Independent Day School,2151
http://dbpedia.org/resource/Maitland_Grossmann_High_School,Maitland Grossmann High School,2157
http://dbpedia.org/resource/Roosevelt_High_School_(Oregon),Roosevelt High School (Oregon),2161
http://dbpedia.org/resource/Newcastle_East_Public_School,Newcastle East Public School,1824
http://dbpedia.org/resource/Davidson_Day_School,Davidson Day School,2170
http://dbpedia.org/resource/Landis_School,Landis School,1751
http://dbpedia.org/resource/Muscle_Shoals_High_School,Muscle Shoals High School,1962
http://dbpedia.org/resource/American_Bilingual_School,American Bilingual School,2013
http://dbpedia.org/resource/Salesian_High_School_(Los_Angeles),Salesian High School (Los Angeles),1814
"http://dbpedia.org/resource/Newman_Catholic_High_School_(Mason_City,_Iowa)","Newman Catholic High School (Mason City, Iowa)",2147
http://dbpedia.org/resource/British_International_School_Ho_Chi_Minh_City,British International School Ho Chi Minh City,2109
http://dbpedia.org/resource/Devonport_High_School_for_Girls,Devonport High School for Girls,1743
http://dbpedia.org/resource/Mountain_View_High_School_(Karnataka),Mountain View High School (Karnataka),2191
http://dbpedia.org/resource/Al-Zahiriyah_Library,Al-Zahiriyah Library,1214
http://dbpedia.org/resource/Wyggeston_and_Queen_Elizabeth_I_College,Wyggeston and Queen Elizabeth I College,1733
http://dbpedia.org/resource/Sheng_Kung_Hui_Lam_Woo_Memorial_Secondary_School,Sheng Kung Hui Lam Woo Memorial Secondary School,2043
http://dbpedia.org/resource/West_Virginia_Schools_for_the_Deaf_and_Blind,West Virginia Schools for the Deaf and Blind,1824
http://dbpedia.org/resource/J._Sterling_Morton_High_School_East,J. Sterling Morton High School East,1819
http://dbpedia.org/resource/San_Bernardino_High_School,San Bernardino High School,1617
http://dbpedia.org/resource/Daycroft_School,Daycroft School,1740
http://dbpedia.org/resource/Biloxi_High_School,Biloxi High School,1992
"http://dbpedia.org/resource/Notre_Dame_High_School_(Elmira,_New_York)","Notre Dame High School (Elmira, New York)",1689
http://dbpedia.org/resource/Roundhay_School,Roundhay School,1958
http://dbpedia.org/resource/Great_Sankey_High_School,Great Sankey High School,1900
"http://dbpedia.org/resource/Mons_Aurea,_Garenkokerskade","Mons Aurea, Garenkokerskade",2085
http://dbpedia.org/resource/Munro_College,Munro College,1643
http://dbpedia.org/resource/Convent_Glen_Catholic_School,Convent Glen Catholic School,2052
http://dbpedia.org/resource/Austin_Preparatory_School,Austin Preparatory School,1718
http://dbpedia.org/resource/Immaculate_Conception_Ukrainian_Catholic_Schools,Immaculate Conception Ukrainian Catholic Schools,1717
"http://dbpedia.org/resource/Wah_Yan_College,_Kowloon","Wah Yan College, Kowloon",2073
http://dbpedia.org/resource/Lyman_School_for_Boys,Lyman School for Boys,1664
http://dbpedia.org/resource/Chitwan_English_Boarding_School,Chitwan English Boarding School,1967
"http://dbpedia.org/resource/Oakwood_School_(Morgan_Hill,_California)","Oakwood School (Morgan Hill, California)",2177
http://dbpedia.org/resource/Yishun_Town_Secondary_School,Yishun Town Secondary School,1728
http://dbpedia.org/resource/Guilsborough_School,Guilsborough School,2039
http://dbpedia.org/resource/The_Kurt_Hahn_Expeditionary_Learning_School,The Kurt Hahn Expeditionary Learning School,1938
http://dbpedia.org/resource/Shree_Damodar_Higher_Secondary_School_of_Science,Shree Damodar Higher Secondary School of Science,1809
http://dbpedia.org/resource/St_Joseph's_Māori_Girls'_College,St Joseph's Māori Girls' College,1694
http://dbpedia.org/resource/Malvern_St_James,Malvern St James,1926
http://dbpedia.org/resource/St._Thomas_of_Villanova_College,St. Thomas of Villanova College,2105
http://dbpedia.org/resource/Piner_High_School,Piner High School,2185
http://dbpedia.org/resource/Oak_Hills_High_School,Oak Hills High School,1863
"http://dbpedia.org/resource/Delhi_Public_School,_Bathinda","Delhi Public School, Bathinda",2248
http://dbpedia.org/resource/Fukuoka_Prefectural_Shuyukan_High_School,Fukuoka Prefectural Shuyukan High School,1537
http://dbpedia.org/resource/Montwood_High_School,Montwood High School,2051
http://dbpedia.org/resource/Columbus_School_for_Girls,Columbus School for Girls,1855
"http://dbpedia.org/resource/St._James'_School,_Binnaguri","St. James' School, Binnaguri",1850
"http://dbpedia.org/resource/The_Abbey_School,_Reading","The Abbey School, Reading",1715
http://dbpedia.org/resource/Pasquotank_County_High_School,Pasquotank County High School,1900
"http://dbpedia.org/resource/Scots_School,_Bathurst","Scots School, Bathurst",2018
http://dbpedia.org/resource/Riverside_High_School_(West_Virginia),Riverside High School (West Virginia),2279
http://dbpedia.org/resource/Milton_High_School_(Florida),Milton High School (Florida),1814
http://dbpedia.org/resource/Wheaton_Warrenville_South_High_School,Wheaton Warrenville South High School,1823
http://dbpedia.org/resource/Deutsche_Schule_Helsinki,Deutsche Schule Helsinki,1885
http://dbpedia.org/resource/King's_Baptist_Grammar_School,King's Baptist Grammar School,1696
http://dbpedia.org/resource/Rossmoyne_Senior_High_School,Rossmoyne Senior High School,1882
http://dbpedia.org/resource/Harford_Technical_High_School,Harford Technical High School,1864
http://dbpedia.org/resource/Sheldon_School,Sheldon School,1910
"http://dbpedia.org/resource/Grandview_High_School_(Aurora,_Colorado)","Grandview High School (Aurora, Colorado)",2102
http://dbpedia.org/resource/Teva_Learning_Center,Teva Learning Center,2110
http://dbpedia.org/resource/Guilford_Young_College,Guilford Young College,2264
http://dbpedia.org/resource/F.G._Public_High_School_Mardan,F.G. Public High School Mardan,2014
http://dbpedia.org/resource/Edwin_Brown_High_School,Edwin Brown High School,1760
http://dbpedia.org/resource/Patricia_Nixon_Elementary_School,Patricia Nixon Elementary School,2046
http://dbpedia.org/resource/Rodborough_School,Rodborough School,2181
http://dbpedia.org/resource/DuSable_High_School,DuSable High School,1799
"http://dbpedia.org/resource/Lawrence_School_(Sagamore_Hills,_Ohio)","Lawrence School (Sagamore Hills, Ohio)",1906
http://dbpedia.org/resource/Hudson_High_School_(Iowa),Hudson High School (Iowa),1806
"http://dbpedia.org/resource/Holy_Cross_Regional_Catholic_School_(Lynchburg,_Virginia)","Holy Cross Regional Catholic School (Lynchburg, Virginia)",2114
http://dbpedia.org/resource/Francis_Tuttle_Technology_Center,Francis Tuttle Technology Center,1940
http://dbpedia.org/resource/J._P._McCaskey_High_School,J. P. McCaskey High School,2151
http://dbpedia.org/resource/Tuxedo_Park_School,Tuxedo Park School,1765
http://dbpedia.org/resource/Boonton_High_School,Boonton High School,2005
http://dbpedia.org/resource/J._W._Hallahan_Catholic_Girls_High_School,J. W. Hallahan Catholic Girls High School,1724
http://dbpedia.org/resource/Semiahmoo_Secondary_School,Semiahmoo Secondary School,1765
http://dbpedia.org/resource/St._Louis_College_of_Valenzuela,St. Louis College of Valenzuela,1844
http://dbpedia.org/resource/Gosford_Hill_School,Gosford Hill School,1844
http://dbpedia.org/resource/Government_College_Umuahia,Government College Umuahia,1677
http://dbpedia.org/resource/Herbert_H._Lehman_High_School,Herbert H. Lehman High School,1757
http://dbpedia.org/resource/Haberdashers'_Aske's_Boys'_School,Haberdashers' Aske's Boys' School,1816
http://dbpedia.org/resource/Loretto_School,Loretto School,1770
http://dbpedia.org/resource/St_Michael's_Collegiate_School,St Michael's Collegiate School,1777
http://dbpedia.org/resource/Goderich_District_Collegiate_Institute,Goderich District Collegiate Institute,2101
http://dbpedia.org/resource/Arts_&_Communication_Magnet_Academy,Arts & Communication Magnet Academy,1881
http://dbpedia.org/resource/Little_Ilford_School,Little Ilford School,1880
http://dbpedia.org/resource/Tranby_College,Tranby College,2188
http://dbpedia.org/resource/Herriman_High_School,Herriman High School,2031
http://dbpedia.org/resource/Westminster_Christian_Academy_(Missouri),Westminster Christian Academy (Missouri),1869
http://dbpedia.org/resource/Notre_Dame_School_(Manhattan),Notre Dame School (Manhattan),1822
"http://dbpedia.org/resource/Wah_Yan_College,_Hong_Kong","Wah Yan College, Hong Kong",1694
http://dbpedia.org/resource/Ernest_Bevin_College,Ernest Bevin College,2196
http://dbpedia.org/resource/Mount_Saint_Michael_Academy,Mount Saint Michael Academy,2041
http://dbpedia.org/resource/Aliso_Niguel_High_School,Aliso Niguel High School,2180
http://dbpedia.org/resource/Marymount_International_School_London,Marymount International School London,1707
http://dbpedia.org/resource/West_Mesquite_High_School,West Mesquite High School,10
http://dbpedia.org/resource/Ao_Tawhiti,Ao Tawhiti,2155
http://dbpedia.org/resource/Winchester_College,Winchester College,1262
http://dbpedia.org/resource/Southeast_High_School_(Florida),Southeast High School (Florida),2012
http://dbpedia.org/resource/North_Cambridge_Academy,North Cambridge Academy,1687
http://dbpedia.org/resource/Indiana_University_High_School,Indiana University High School,1960
