http://dbpedia.org/ontology/School,School,http://dbpedia.org/ontology/numberOfStudents
http://dbpedia.org/resource/Oxon_Hill_High_School,Oxon Hill High School,1642
http://dbpedia.org/resource/Ravenswood_High_School_(East_Palo_Alto),Ravenswood High School (East Palo Alto),856
http://dbpedia.org/resource/Trinity_School_of_John_Whitgift,Trinity School of John Whitgift,1079
http://dbpedia.org/resource/Chandler_School,Chandler School,400
http://dbpedia.org/resource/Cleveland_High_School_(Tennessee),Cleveland High School (Tennessee),1300
http://dbpedia.org/resource/Blacklick_Valley_School_District,Blacklick Valley School District,559
"http://dbpedia.org/resource/Bluffton_High_School_(Bluffton,_Ohio)","Bluffton High School (Bluffton, Ohio)",328
http://dbpedia.org/resource/Jewish_Day_School_of_Metropolitan_Seattle,Jewish Day School of Metropolitan Seattle,246
http://dbpedia.org/resource/Northwest_School,Northwest School,475
http://dbpedia.org/resource/Bridgewater_School,Bridgewater School,653
http://dbpedia.org/resource/Prestfelde_School,Prestfelde School,275
http://dbpedia.org/resource/Sarasas_Ektra_School,Sarasas Ektra School,2614
"http://dbpedia.org/resource/American_Heritage_School_(American_Fork,_Utah)","American Heritage School (American Fork, Utah)",711
http://dbpedia.org/resource/Palmyra_Area_School_District,Palmyra Area School District,3593
http://dbpedia.org/resource/Chilton_Trinity_School,Chilton Trinity School,1070
http://dbpedia.org/resource/Handsworth_Secondary_School,Handsworth Secondary School,1699
http://dbpedia.org/resource/Wyoming_East_High_School,Wyoming East High School,699
"http://dbpedia.org/resource/Alexander_Graham_Bell_School_(Chicago,_Illinois)","Alexander Graham Bell School (Chicago, Illinois)",1145
http://dbpedia.org/resource/Hazleton_Area_School_District,Hazleton Area School District,10438
http://dbpedia.org/resource/SMS_Tengku_Muhammad_Faris_Petra,SMS Tengku Muhammad Faris Petra,893
http://dbpedia.org/resource/Lyndale_Secondary_College,Lyndale Secondary College,962
http://dbpedia.org/resource/Highcliffe_School,Highcliffe School,1259
http://dbpedia.org/resource/Visitation_Academy_of_St._Louis,Visitation Academy of St. Louis,632
"http://dbpedia.org/resource/Saint_Albert_High_School_(Council_Bluffs,_Iowa)","Saint Albert High School (Council Bluffs, Iowa)",341
http://dbpedia.org/resource/Coombe_Boys'_School,Coombe Boys' School,783
http://dbpedia.org/resource/Archbishop_Temple_School,Archbishop Temple School,683
http://dbpedia.org/resource/Elmwood_Park_High_School_(Illinois),Elmwood Park High School (Illinois),1157
http://dbpedia.org/resource/St._Patrick_High_School_(Chicago),St. Patrick High School (Chicago),894
http://dbpedia.org/resource/Timothy_Christian_School_(Illinois),Timothy Christian School (Illinois),382
http://dbpedia.org/resource/Atomic_Energy_Central_School,Atomic Energy Central School,518
http://dbpedia.org/resource/Bronzeville_Scholastic_Institute,Bronzeville Scholastic Institute,458
http://dbpedia.org/resource/Prince_William_School,Prince William School,1122
http://dbpedia.org/resource/St_Anselm's_College,St Anselm's College,896
"http://dbpedia.org/resource/King's_School,_Rochester","King's School, Rochester",832
http://dbpedia.org/resource/Morristown_Junior-Senior_High_School,Morristown Junior-Senior High School,353
http://dbpedia.org/resource/Sir_Oliver_Mowat_Collegiate_Institute,Sir Oliver Mowat Collegiate Institute,1007
http://dbpedia.org/resource/Countesthorpe_Leysland_Community_College,Countesthorpe Leysland Community College,1298
http://dbpedia.org/resource/St._Ambrose_Academy,St. Ambrose Academy,80
"http://dbpedia.org/resource/St_Joseph's_Senior_Secondary_School,_Rihand_Nagar","St Joseph's Senior Secondary School, Rihand Nagar",691
http://dbpedia.org/resource/Randolph_School,Randolph School,1152
http://dbpedia.org/resource/Prairie_City_School,Prairie City School,154
http://dbpedia.org/resource/Shailesh_J._Mehta_School_of_Management,Shailesh J. Mehta School of Management,225
http://dbpedia.org/resource/Corner_Brook_Regional_High,Corner Brook Regional High,930
http://dbpedia.org/resource/Colquitt_County_School_District,Colquitt County School District,7335
"http://dbpedia.org/resource/Cleveland_High_School_(Seattle,_Washington)","Cleveland High School (Seattle, Washington)",806
http://dbpedia.org/resource/Harris_City_Academy_Crystal_Palace,Harris City Academy Crystal Palace,576
http://dbpedia.org/resource/Holland_Public_Schools,Holland Public Schools,4670
http://dbpedia.org/resource/Reading_Memorial_High_School,Reading Memorial High School,1457
"http://dbpedia.org/resource/The_Martin_High_School,_Anstey","The Martin High School, Anstey",506
http://dbpedia.org/resource/Levine_School_of_Music,Levine School of Music,3565
http://dbpedia.org/resource/Torrey_Pines_High_School,Torrey Pines High School,2798
http://dbpedia.org/resource/Sacred_Heart_Academy_(Louisville),Sacred Heart Academy (Louisville),975
http://dbpedia.org/resource/Escuela_Superior_de_Comercio_Carlos_Pellegrini,Escuela Superior de Comercio Carlos Pellegrini,2267
http://dbpedia.org/resource/Regional_Science_High_School_Union,Regional Science High School Union,10
http://dbpedia.org/resource/Woodhaven-Brownstown_School_District,Woodhaven-Brownstown School District,4553
http://dbpedia.org/resource/Kangwon_National_University_School_of_Law,Kangwon National University School of Law,116
http://dbpedia.org/resource/Canterbury_School_(Connecticut),Canterbury School (Connecticut),343
http://dbpedia.org/resource/Bullers_Wood_School,Bullers Wood School,1142
http://dbpedia.org/resource/W._B._Ray_High_School,W. B. Ray High School,2270
"http://dbpedia.org/resource/Covington_High_School_(Covington,_Louisiana)","Covington High School (Covington, Louisiana)",1127
http://dbpedia.org/resource/Coeur_d'Alene_Charter_Academy,Coeur d'Alene Charter Academy,624
http://dbpedia.org/resource/Winter_Haven_Christian_School,Winter Haven Christian School,393
http://dbpedia.org/resource/Mansfield_High_School_(Massachusetts),Mansfield High School (Massachusetts),1373
http://dbpedia.org/resource/Pershing_Middle_School_(Houston),Pershing Middle School (Houston),1465
http://dbpedia.org/resource/Princeville_High_School,Princeville High School,239
http://dbpedia.org/resource/Winston_Knoll_Collegiate,Winston Knoll Collegiate,1039
http://dbpedia.org/resource/Omaha_Northwest_High_School,Omaha Northwest High School,1207
http://dbpedia.org/resource/Bishop_LeBlond_High_School,Bishop LeBlond High School,209
http://dbpedia.org/resource/Artesia_High_School_(California),Artesia High School (California),2083
http://dbpedia.org/resource/Wyedean_School,Wyedean School,1357
http://dbpedia.org/resource/Centro_Escolar_el_Encino,Centro Escolar el Encino,489
http://dbpedia.org/resource/Lake_Brantley_High_School,Lake Brantley High School,2928
http://dbpedia.org/resource/Luther_High_School_(Wisconsin),Luther High School (Wisconsin),6
http://dbpedia.org/resource/Meharry_Medical_College_School_of_Dentistry,Meharry Medical College School of Dentistry,194
"http://dbpedia.org/resource/Heritage_High_School_(Leesburg,_Virginia)","Heritage High School (Leesburg, Virginia)",1383
http://dbpedia.org/resource/Canton_Area_School_District,Canton Area School District,1114
http://dbpedia.org/resource/Souderton_Area_High_School,Souderton Area High School,2926
http://dbpedia.org/resource/Marlin_High_School_(Texas),Marlin High School (Texas),286
http://dbpedia.org/resource/Aurelia_High_School,Aurelia High School,83
http://dbpedia.org/resource/Pacific_Crest_Community_School,Pacific Crest Community School,93
http://dbpedia.org/resource/Coachella_Valley_High_School,Coachella Valley High School,2910
http://dbpedia.org/resource/Lake_Oswego_High_School,Lake Oswego High School,1523
http://dbpedia.org/resource/Craigholme_School,Craigholme School,288
http://dbpedia.org/resource/Marcellus_High_School,Marcellus High School,602
http://dbpedia.org/resource/Woodstock_High_School_(Georgia),Woodstock High School (Georgia),2441
"http://dbpedia.org/resource/Coronado_High_School_(Coronado,_California)","Coronado High School (Coronado, California)",822
http://dbpedia.org/resource/Braintree_Sixth_Form,Braintree Sixth Form,232
http://dbpedia.org/resource/Eastern_Commerce_Collegiate_Institute,Eastern Commerce Collegiate Institute,210
http://dbpedia.org/resource/Danville_High_School_(Pennsylvania),Danville High School (Pennsylvania),631
http://dbpedia.org/resource/Martinsville_High_School_(Indiana),Martinsville High School (Indiana),1674
http://dbpedia.org/resource/Spa_School,Spa School,85
http://dbpedia.org/resource/Fort_Vancouver_High_School,Fort Vancouver High School,1542
"http://dbpedia.org/resource/John_F._Kennedy_Catholic_High_School_(Somers,_New_York)","John F. Kennedy Catholic High School (Somers, New York)",503
"http://dbpedia.org/resource/King_Edward's_School,_Birmingham","King Edward's School, Birmingham",716
http://dbpedia.org/resource/Westminster_School,Westminster School,751
http://dbpedia.org/resource/Dutch_Fork_High_School,Dutch Fork High School,2187
http://dbpedia.org/resource/Bishop_Westcott_Boys'_School,Bishop Westcott Boys' School,2140
http://dbpedia.org/resource/Peters_Township_School_District,Peters Township School District,5175
"http://dbpedia.org/resource/International_Turkish_Hope_School,_Dhaka","International Turkish Hope School, Dhaka",1766
http://dbpedia.org/resource/Winchester_Thurston_School,Winchester Thurston School,688
http://dbpedia.org/resource/Baptist_Lui_Ming_Choi_Secondary_School,Baptist Lui Ming Choi Secondary School,1283
http://dbpedia.org/resource/Mahanoy_Area_School_District,Mahanoy Area School District,1041
http://dbpedia.org/resource/Milton_High_School_(Wisconsin),Milton High School (Wisconsin),1068
http://dbpedia.org/resource/Rosepine_High_School,Rosepine High School,469
http://dbpedia.org/resource/Western_Branch_High_School,Western Branch High School,2523
http://dbpedia.org/resource/Doha_British_School,Doha British School,1281
http://dbpedia.org/resource/John_R._Rogers_High_School,John R. Rogers High School,1456
http://dbpedia.org/resource/Immanuel_High_School,Immanuel High School,296
http://dbpedia.org/resource/Beulah_High_School,Beulah High School,279
"http://dbpedia.org/resource/John_F._Kennedy_High_School_(Richmond,_California)","John F. Kennedy High School (Richmond, California)",1131
http://dbpedia.org/resource/Harold_S._Vincent_High_School,Harold S. Vincent High School,1159
http://dbpedia.org/resource/Scattergood_Friends_School,Scattergood Friends School,54
http://dbpedia.org/resource/Staley_High_School,Staley High School,1588
http://dbpedia.org/resource/Calvin_Christian_Collegiate,Calvin Christian Collegiate,225
http://dbpedia.org/resource/Boiling_Springs_High_School_(Pennsylvania),Boiling Springs High School (Pennsylvania),687
"http://dbpedia.org/resource/Southside_High_School_(Batesville,_Arkansas)","Southside High School (Batesville, Arkansas)",537
http://dbpedia.org/resource/Skyline_High_School_(Michigan),Skyline High School (Michigan),1479
"http://dbpedia.org/resource/Al_Manar_Central_College,_Galhinna","Al Manar Central College, Galhinna",1726
http://dbpedia.org/resource/Bartley_Green_School,Bartley Green School,939
http://dbpedia.org/resource/Seaford_College,Seaford College,629
http://dbpedia.org/resource/Bradley_Stoke_Community_School,Bradley Stoke Community School,978
"http://dbpedia.org/resource/Heritage_Community_Christian_School_(Brockville,_Ontario)","Heritage Community Christian School (Brockville, Ontario)",37
http://dbpedia.org/resource/Augusta_High_School_(Arkansas),Augusta High School (Arkansas),202
http://dbpedia.org/resource/École_secondaire_catholique_Thériault,École secondaire catholique Thériault,805
http://dbpedia.org/resource/Port_Said_American_School,Port Said American School,252
"http://dbpedia.org/resource/Northwestern_High_School_(Rock_Hill,_South_Carolina)","Northwestern High School (Rock Hill, South Carolina)",1686
http://dbpedia.org/resource/Littlemoss_High_School,Littlemoss High School,505
http://dbpedia.org/resource/Largo_High_School_(Maryland),Largo High School (Maryland),1033
http://dbpedia.org/resource/Myron_B._Thompson_Academy,Myron B. Thompson Academy,710
http://dbpedia.org/resource/North_Delta_Secondary_School,North Delta Secondary School,1021
http://dbpedia.org/resource/Echo_School_(Oregon),Echo School (Oregon),300
http://dbpedia.org/resource/Wando_High_School,Wando High School,3708
http://dbpedia.org/resource/Porter-Gaud_School,Porter-Gaud School,801
http://dbpedia.org/resource/Father_Judge_High_School,Father Judge High School,799
http://dbpedia.org/resource/Steinert_High_School,Steinert High School,1484
http://dbpedia.org/resource/Dracut_High_School,Dracut High School,684
http://dbpedia.org/resource/Indian_Institute_of_Management_Indore,Indian Institute of Management Indore,1052
http://dbpedia.org/resource/Sargodha_Institute_of_Technology,Sargodha Institute of Technology,1045
http://dbpedia.org/resource/Hanford_Joint_Union_High_School_District,Hanford Joint Union High School District,1622
"http://dbpedia.org/resource/St_Francis'_College,_Letchworth","St Francis' College, Letchworth",439
"http://dbpedia.org/resource/Huron_High_School_(New_Boston,_Michigan)","Huron High School (New Boston, Michigan)",1068
http://dbpedia.org/resource/Caringbah_High_School,Caringbah High School,953
http://dbpedia.org/resource/Longcroft_School,Longcroft School,1747
http://dbpedia.org/resource/Bramdean_School,Bramdean School,145
"http://dbpedia.org/resource/Houston_High_School_(Germantown,_Tennessee)","Houston High School (Germantown, Tennessee)",1591
http://dbpedia.org/resource/Connellsville_Area_Career_and_Technology_Center,Connellsville Area Career and Technology Center,475
http://dbpedia.org/resource/Jewish_Community_High_School_of_the_Bay,Jewish Community High School of the Bay,189
http://dbpedia.org/resource/Anderson_County_High_School_(Kansas),Anderson County High School (Kansas),434
http://dbpedia.org/resource/Eastern_Lebanon_County_High_School,Eastern Lebanon County High School,861
http://dbpedia.org/resource/Cambridge_Rindge_and_Latin_School,Cambridge Rindge and Latin School,1738
http://dbpedia.org/resource/Tyler_Independent_School_District,Tyler Independent School District,18688
http://dbpedia.org/resource/Bishop_Moore_High_School,Bishop Moore High School,1407
http://dbpedia.org/resource/Lundsbergs_boarding_school,Lundsbergs boarding school,234
"http://dbpedia.org/resource/William_Mason_High_School_(Mason,_Ohio)","William Mason High School (Mason, Ohio)",3755
http://dbpedia.org/resource/Glen_A._Wilson_High_School,Glen A. Wilson High School,1718
http://dbpedia.org/resource/Winstanley_College,Winstanley College,1722
"http://dbpedia.org/resource/Carmel_High_School_(Carmel,_California)","Carmel High School (Carmel, California)",786
http://dbpedia.org/resource/Colorado_Rocky_Mountain_School,Colorado Rocky Mountain School,175
http://dbpedia.org/resource/St_Cyprian's_School,St Cyprian's School,94
http://dbpedia.org/resource/Lincoln-Way_West_High_School,Lincoln-Way West High School,1307
http://dbpedia.org/resource/Henry_Kendall_High_School,Henry Kendall High School,809
http://dbpedia.org/resource/York_College_(York),York College (York),0
http://dbpedia.org/resource/Jamia_Uloom-ul-Islamia,Jamia Uloom-ul-Islamia,11592
"http://dbpedia.org/resource/Cardinal_Spellman_High_School_(Brockton,_Massachusetts)","Cardinal Spellman High School (Brockton, Massachusetts)",611
http://dbpedia.org/resource/Asia_Pacific_International_School,Asia Pacific International School,352
http://dbpedia.org/resource/Louise-Schroeder-Gymnasium,Louise-Schroeder-Gymnasium,856
http://dbpedia.org/resource/The_Judge_Charles_J._Vallone_School,The Judge Charles J. Vallone School,385
"http://dbpedia.org/resource/Cathedral_High_School_(New_Ulm,_Minnesota)","Cathedral High School (New Ulm, Minnesota)",120
http://dbpedia.org/resource/Charlotte_School_of_Law,Charlotte School of Law,1268
http://dbpedia.org/resource/Pearl_City_High_School_(Hawaii),Pearl City High School (Hawaii),1663
http://dbpedia.org/resource/Newport_Central_Catholic_High_School,Newport Central Catholic High School,386
http://dbpedia.org/resource/Madera_South_High_School,Madera South High School,3615
http://dbpedia.org/resource/State_Elementary_School_Cipinang_Melayu_11_Petang,State Elementary School Cipinang Melayu 11 Petang,327
http://dbpedia.org/resource/Churchland_High_School,Churchland High School,1589
http://dbpedia.org/resource/Xavier_College_Preparatory_High_School_(California),Xavier College Preparatory High School (California),2
http://dbpedia.org/resource/Lord_Byng_Secondary_School,Lord Byng Secondary School,1368
http://dbpedia.org/resource/West_Mesquite_High_School,West Mesquite High School,1777
http://dbpedia.org/resource/Austin_Community_Academy_High_School,Austin Community Academy High School,221
http://dbpedia.org/resource/Westhill_High_School_(Connecticut),Westhill High School (Connecticut),2331
http://dbpedia.org/resource/Haines_High_School,Haines High School,83
http://dbpedia.org/resource/The_Mary_Louis_Academy,The Mary Louis Academy,828
http://dbpedia.org/resource/Watford_Grammar_School_for_Boys,Watford Grammar School for Boys,1423
http://dbpedia.org/resource/Oswego_East_High_School,Oswego East High School,2202
http://dbpedia.org/resource/Cromwell_High_School,Cromwell High School,547
"http://dbpedia.org/resource/Royal_Grammar_School,_Newcastle_upon_Tyne","Royal Grammar School, Newcastle upon Tyne",1145
http://dbpedia.org/resource/The_Bourne_Academy,The Bourne Academy,598
http://dbpedia.org/resource/Southern_Cross_Catholic_College,Southern Cross Catholic College,11
http://dbpedia.org/resource/Tupelo_High_School,Tupelo High School,1641
http://dbpedia.org/resource/Weston_Road_Academy,Weston Road Academy,813
"http://dbpedia.org/resource/Theodore_Roosevelt_High_School_(Kent,_Ohio)","Theodore Roosevelt High School (Kent, Ohio)",1350
http://dbpedia.org/resource/North_Mesquite_High_School,North Mesquite High School,2386
http://dbpedia.org/resource/Eastland_High_School_(Illinois),Eastland High School (Illinois),269
http://dbpedia.org/resource/St._Croix_Central_High_School_(Virgin_Islands),St. Croix Central High School (Virgin Islands),1532
http://dbpedia.org/resource/Ludlow_Church_of_England_School,Ludlow Church of England School,784
http://dbpedia.org/resource/Whittier_High_School,Whittier High School,2221
"http://dbpedia.org/resource/Colegio_San_José,_San_Germán,_PR","Colegio San José, San Germán, PR",209
http://dbpedia.org/resource/Worsley_Wardley_Grammar_School,Worsley Wardley Grammar School,589
http://dbpedia.org/resource/Holy_Rosary_High_School_(New_Orleans),Holy Rosary High School (New Orleans),135
http://dbpedia.org/resource/Rose_Hill_School,Rose Hill School,0
http://dbpedia.org/resource/Stewarts_Creek_High_School,Stewarts Creek High School,1734
http://dbpedia.org/resource/Arcadia_Unified_School_District,Arcadia Unified School District,858
http://dbpedia.org/resource/Bainbridge_High_School_(Washington),Bainbridge High School (Washington),1452
http://dbpedia.org/resource/Woolmer_Hill_School,Woolmer Hill School,863
http://dbpedia.org/resource/West_Greene_School_District,West Greene School District,826
http://dbpedia.org/resource/Private_High_School_Kolhapur,Private High School Kolhapur,1877
http://dbpedia.org/resource/Toms_River_High_School_East,Toms River High School East,1676
http://dbpedia.org/resource/Farragut_Career_Academy,Farragut Career Academy,1072
http://dbpedia.org/resource/Remsen-Union_High_School,Remsen-Union High School,98
http://dbpedia.org/resource/Paraclete_High_School,Paraclete High School,816
http://dbpedia.org/resource/North_Hall_High_School,North Hall High School,1030
"http://dbpedia.org/resource/Sainik_School,_Kunjpura","Sainik School, Kunjpura",529
http://dbpedia.org/resource/C.H._Yoe_High_School,C.H. Yoe High School,333
http://dbpedia.org/resource/Lanier_County_High_School,Lanier County High School,411
http://dbpedia.org/resource/Conemaugh_Township_Area_School_District,Conemaugh Township Area School District,933
http://dbpedia.org/resource/Speedway_Senior_High_School,Speedway Senior High School,420
http://dbpedia.org/resource/White_Knoll_High_School,White Knoll High School,2152
http://dbpedia.org/resource/Florida_State_University_College_of_Human_Sciences,Florida State University College of Human Sciences,3143
"http://dbpedia.org/resource/Westminster_Academy,_London","Westminster Academy, London",948
http://dbpedia.org/resource/Fairdale_High_School,Fairdale High School,1196
http://dbpedia.org/resource/Jotham_W._Wakeman_Public_School_Number_6,Jotham W. Wakeman Public School Number 6,901
"http://dbpedia.org/resource/Lee_County_High_School_(Leesburg,_Georgia)","Lee County High School (Leesburg, Georgia)",1599
http://dbpedia.org/resource/Bristol-Plymouth_Regional_Technical_School,Bristol-Plymouth Regional Technical School,1601
http://dbpedia.org/resource/Belhaven_Hill_School,Belhaven Hill School,116
http://dbpedia.org/resource/Philipsburg-Osceola_School_District,Philipsburg-Osceola School District,1852
http://dbpedia.org/resource/New_Hope_High_School_(Mississippi),New Hope High School (Mississippi),1021
http://dbpedia.org/resource/Beech_Hall_School,Beech Hall School,229
http://dbpedia.org/resource/Dothan_High_School,Dothan High School,1210
http://dbpedia.org/resource/Western_Beaver_County_School_District,Western Beaver County School District,724
http://dbpedia.org/resource/Ampleforth_College,Ampleforth College,671
http://dbpedia.org/resource/Knightdale_High_School,Knightdale High School,1672
http://dbpedia.org/resource/Joseph_High_School,Joseph High School,85
http://dbpedia.org/resource/Ashbourne_College,Ashbourne College,281
http://dbpedia.org/resource/St._Maurice_School,St. Maurice School,604
http://dbpedia.org/resource/Taipei_American_School,Taipei American School,720
http://dbpedia.org/resource/South_River_High_School_(Maryland),South River High School (Maryland),1999
http://dbpedia.org/resource/Blenheim_High_School,Blenheim High School,1576
http://dbpedia.org/resource/Jefferson_County_Public_Schools_(Colorado),Jefferson County Public Schools (Colorado),92491
"http://dbpedia.org/resource/Forest_School,_Walthamstow","Forest School, Walthamstow",1121
http://dbpedia.org/resource/Belle_Vernon_Area_School_District,Belle Vernon Area School District,2165
http://dbpedia.org/resource/Waterloo_High_School_(Illinois),Waterloo High School (Illinois),876
"http://dbpedia.org/resource/St_Thomas_More_Catholic_School,_Blaydon","St Thomas More Catholic School, Blaydon",1267
"http://dbpedia.org/resource/Little_Flower_School,_Mudinepalli","Little Flower School, Mudinepalli",515
http://dbpedia.org/resource/Maine_West_High_School,Maine West High School,1907
http://dbpedia.org/resource/Rougemont_School,Rougemont School,602
http://dbpedia.org/resource/Hill_House_School,Hill House School,996
http://dbpedia.org/resource/Gulf_Islands_Secondary_School,Gulf Islands Secondary School,605
http://dbpedia.org/resource/Harry_Ainlay_High_School,Harry Ainlay High School,2138
http://dbpedia.org/resource/RSA_Academy_Arrow_Vale,RSA Academy Arrow Vale,620
http://dbpedia.org/resource/Haverford_School,Haverford School,386
http://dbpedia.org/resource/New_Haven_Adult_School,New Haven Adult School,2175
http://dbpedia.org/resource/Arendell_Parrott_Academy,Arendell Parrott Academy,882
http://dbpedia.org/resource/Lawton_High_School_(Oklahoma),Lawton High School (Oklahoma),1707
http://dbpedia.org/resource/GW_Community_School,GW Community School,50
"http://dbpedia.org/resource/Heritage_High_School_(Baltimore,_Maryland)","Heritage High School (Baltimore, Maryland)",367
http://dbpedia.org/resource/Waco_High_School,Waco High School,1730
http://dbpedia.org/resource/Calhoun_High_School_(Texas),Calhoun High School (Texas),1158
http://dbpedia.org/resource/St._Helens_High_School,St. Helens High School,971
http://dbpedia.org/resource/Arnold_Lodge_School,Arnold Lodge School,195
"http://dbpedia.org/resource/Harding_Academy_(Searcy,_Arkansas)","Harding Academy (Searcy, Arkansas)",581
http://dbpedia.org/resource/Northgate_Junior_–_Senior_High_School,Northgate Junior – Senior High School,882
"http://dbpedia.org/resource/Woodleigh_School,_North_Yorkshire","Woodleigh School, North Yorkshire",49
http://dbpedia.org/resource/Tuscarora_School_District,Tuscarora School District,2461
http://dbpedia.org/resource/Marden_High_School,Marden High School,720
http://dbpedia.org/resource/East_Lake_High_School,East Lake High School,2146
"http://dbpedia.org/resource/Chaucer_School,_Sheffield","Chaucer School, Sheffield",757
http://dbpedia.org/resource/Juniata_County_School_District,Juniata County School District,3384
http://dbpedia.org/resource/Western_Technical-Commercial_School,Western Technical-Commercial School,996
http://dbpedia.org/resource/Brazoswood_High_School,Brazoswood High School,2419
http://dbpedia.org/resource/Prattville_High_School,Prattville High School,2121
"http://dbpedia.org/resource/Broken_Bow_High_School_(Broken_Bow,_Nebraska)","Broken Bow High School (Broken Bow, Nebraska)",249
http://dbpedia.org/resource/English_School_attached_to_Guangdong_University_of_Foreign_Studies,English School attached to Guangdong University of Foreign Studies,4875
http://dbpedia.org/resource/Chiloquin_High_School,Chiloquin High School,235
http://dbpedia.org/resource/Fellowes_High_School,Fellowes High School,851
http://dbpedia.org/resource/Lockers_Park_School,Lockers Park School,146
"http://dbpedia.org/resource/John_F._Kennedy_High_School_(Fremont,_California)","John F. Kennedy High School (Fremont, California)",1579
"http://dbpedia.org/resource/Holy_Cross_College,_Dhaka","Holy Cross College, Dhaka",914
http://dbpedia.org/resource/Dubai_American_Academy,Dubai American Academy,2392
http://dbpedia.org/resource/Fuqua_School,Fuqua School,336
http://dbpedia.org/resource/Jesse_O._Sanderson_High_School,Jesse O. Sanderson High School,2049
