http://dbpedia.org/ontology/School,School,http://dbpedia.org/ontology/numberOfStudents
http://dbpedia.org/resource/Clarkston_High_School_(Michigan),Clarkston High School (Michigan),2157
http://dbpedia.org/resource/Waterloo_Collegiate_Institute,Waterloo Collegiate Institute,1527
http://dbpedia.org/resource/Shirley_High_School,Shirley High School,815
http://dbpedia.org/resource/Britannia_Secondary_School,Britannia Secondary School,796
http://dbpedia.org/resource/Pingree_School,Pingree School,317
http://dbpedia.org/resource/West_Craven_High_School_(Vanceboro),West Craven High School (Vanceboro),970
http://dbpedia.org/resource/Daniel_Murphy_High_School,Daniel Murphy High School,311
"http://dbpedia.org/resource/Perry_High_School_(Stark_County,_Ohio)","Perry High School (Stark County, Ohio)",1753
http://dbpedia.org/resource/Bilton_School,Bilton School,1078
http://dbpedia.org/resource/Abilene_High_School_(Texas),Abilene High School (Texas),1898
http://dbpedia.org/resource/Bradford_Grammar_School,Bradford Grammar School,1318
"http://dbpedia.org/resource/Bellevue_High_School_(Bellevue,_Washington)","Bellevue High School (Bellevue, Washington)",1692
http://dbpedia.org/resource/Westfield_State_University,Westfield State University,5050
http://dbpedia.org/resource/Hutto_High_School,Hutto High School,1278
http://dbpedia.org/resource/Deakin_University_School_of_Medicine,Deakin University School of Medicine,565
http://dbpedia.org/resource/Liberty_Independent_School_District,Liberty Independent School District,2273
http://dbpedia.org/resource/Wethersfield_High_School_(Connecticut),Wethersfield High School (Connecticut),1039
http://dbpedia.org/resource/Cottesloe_School,Cottesloe School,1301
http://dbpedia.org/resource/Aiyas_Matriculation_Higher_Secondary_School,Aiyas Matriculation Higher Secondary School,198
http://dbpedia.org/resource/Calday_Grange_Grammar_School,Calday Grange Grammar School,1228
http://dbpedia.org/resource/Outwood_Academy_Bydales,Outwood Academy Bydales,790
http://dbpedia.org/resource/Atomic_Energy_Central_School,Atomic Energy Central School,713
http://dbpedia.org/resource/LISA_Academy,LISA Academy,276
"http://dbpedia.org/resource/Abraham_Lincoln_High_School_(Des_Moines,_Iowa)","Abraham Lincoln High School (Des Moines, Iowa)",2147
http://dbpedia.org/resource/Holy_Trinity_High_School_(Chicago),Holy Trinity High School (Chicago),321
http://dbpedia.org/resource/British_Overseas_School,British Overseas School,145
http://dbpedia.org/resource/Huntington_Beach_High_School,Huntington Beach High School,2383
http://dbpedia.org/resource/North_Columbia_Academy,North Columbia Academy,34
http://dbpedia.org/resource/Bladensburg_High_School,Bladensburg High School,1623
http://dbpedia.org/resource/Dundalk_High_School,Dundalk High School,1182
http://dbpedia.org/resource/Rochester_High_School_(Michigan),Rochester High School (Michigan),1718
http://dbpedia.org/resource/Bangpakok_Wittayakom_School,Bangpakok Wittayakom School,3389
http://dbpedia.org/resource/Ralston_Valley_High_School,Ralston Valley High School,1647
http://dbpedia.org/resource/Deutsche_Evangelische_Oberschule,Deutsche Evangelische Oberschule,1454
http://dbpedia.org/resource/Santa_Paula_High_School,Santa Paula High School,2010
"http://dbpedia.org/resource/Saint_Pius_X_High_School_(Lower_Pottsgrove_Township,_Pennsylvania)","Saint Pius X High School (Lower Pottsgrove Township, Pennsylvania)",481
http://dbpedia.org/resource/Chicago_Military_Academy,Chicago Military Academy,311
http://dbpedia.org/resource/Thunderbird_High_School,Thunderbird High School,1832
"http://dbpedia.org/resource/Redwood_High_School_(Larkspur,_California)","Redwood High School (Larkspur, California)",1133
http://dbpedia.org/resource/York_House_School,York House School,777
http://dbpedia.org/resource/Denham_Springs_Freshman_High_School,Denham Springs Freshman High School,905
http://dbpedia.org/resource/Moscrop_Secondary_School,Moscrop Secondary School,1694
http://dbpedia.org/resource/Hazelwick_School,Hazelwick School,2145
http://dbpedia.org/resource/Edgemont_Junior_–_Senior_High_School,Edgemont Junior – Senior High School,993
http://dbpedia.org/resource/Drayton_School,Drayton School,558
"http://dbpedia.org/resource/Stanborough_School,_Welwyn_Garden_City","Stanborough School, Welwyn Garden City",1239
http://dbpedia.org/resource/Bothell_High_School,Bothell High School,1462
http://dbpedia.org/resource/Friendship_Collegiate_Academy_Public_Charter_School,Friendship Collegiate Academy Public Charter School,1280
http://dbpedia.org/resource/Carbondale_Area_School_District,Carbondale Area School District,1347
http://dbpedia.org/resource/Fannett-Metal_School_District,Fannett-Metal School District,541
http://dbpedia.org/resource/Pendleton_Heights_High_School,Pendleton Heights High School,1468
http://dbpedia.org/resource/De_Shalit_High_School,De Shalit High School,2272
http://dbpedia.org/resource/James_M._Bennett_High_School,James M. Bennett High School,1627
http://dbpedia.org/resource/Los_Angeles_Center_for_Enriched_Studies,Los Angeles Center for Enriched Studies,1849
"http://dbpedia.org/resource/Nimitz_High_School_(Harris_County,_Texas)","Nimitz High School (Harris County, Texas)",3677
http://dbpedia.org/resource/Subiaco_Academy,Subiaco Academy,203
http://dbpedia.org/resource/Talbot_Heath_School,Talbot Heath School,2
http://dbpedia.org/resource/Ma'ayanot_Yeshiva_High_School,Ma'ayanot Yeshiva High School,284
"http://dbpedia.org/resource/North_Star_Academy_(Redwood_City,_California)","North Star Academy (Redwood City, California)",496
"http://dbpedia.org/resource/Valley_Christian_High_School_(San_Jose,_California)","Valley Christian High School (San Jose, California)",1196
http://dbpedia.org/resource/Robert_F._Hall_Catholic_Secondary_School,Robert F. Hall Catholic Secondary School,1978
http://dbpedia.org/resource/Grayson_County_High_School_(Kentucky),Grayson County High School (Kentucky),1209
http://dbpedia.org/resource/El_Dorado_High_School_(Kansas),El Dorado High School (Kansas),560
"http://dbpedia.org/resource/Collegiate_School_(Richmond,_Virginia)","Collegiate School (Richmond, Virginia)",1754
http://dbpedia.org/resource/Marylhurst_University,Marylhurst University,1365
http://dbpedia.org/resource/McGavock_High_School,McGavock High School,2886
http://dbpedia.org/resource/Lincoln_City_Career_Technical_High_School,Lincoln City Career Technical High School,45
http://dbpedia.org/resource/Clyst_Vale_Community_College,Clyst Vale Community College,1091
http://dbpedia.org/resource/Nativity_BVM_High_School,Nativity BVM High School,187
http://dbpedia.org/resource/Manatee_High_School,Manatee High School,2630
"http://dbpedia.org/resource/Convent_of_Jesus_and_Mary,_Lahore","Convent of Jesus and Mary, Lahore",2277
http://dbpedia.org/resource/Goodland_Academy,Goodland Academy,36
http://dbpedia.org/resource/St_Paul's_Catholic_College_(Burgess_Hill),St Paul's Catholic College (Burgess Hill),1012
http://dbpedia.org/resource/Julian_Charter_School,Julian Charter School,2095
http://dbpedia.org/resource/The_Governor's_Academy,The Governor's Academy,457
http://dbpedia.org/resource/Sydney_Academy,Sydney Academy,907
http://dbpedia.org/resource/Lawrence_Free_State_High_School,Lawrence Free State High School,1564
http://dbpedia.org/resource/Immacolata_School,Immacolata School,296
http://dbpedia.org/resource/Carpenter_Community_Charter_School,Carpenter Community Charter School,855
http://dbpedia.org/resource/John_F._Kennedy_High_School_(Guam),John F. Kennedy High School (Guam),2753
http://dbpedia.org/resource/White_Bear_Lake_Area_High_School,White Bear Lake Area High School,2716
http://dbpedia.org/resource/Westminster_Seminary_California,Westminster Seminary California,148
http://dbpedia.org/resource/Abbey_Park_High_School,Abbey Park High School,1427
http://dbpedia.org/resource/Kyle_Academy,Kyle Academy,848
http://dbpedia.org/resource/Florida_International_University_College_of_Law,Florida International University College of Law,510
http://dbpedia.org/resource/Perth_High_School,Perth High School,1
http://dbpedia.org/resource/Irrigon_Junior/Senior_High_School,Irrigon Junior/Senior High School,266
http://dbpedia.org/resource/Don_Bosco_Bandel,Don Bosco Bandel,2053
http://dbpedia.org/resource/Yeshivat_Shaare_Torah,Yeshivat Shaare Torah,740
http://dbpedia.org/resource/New_Kensington–Arnold_School_District,New Kensington–Arnold School District,2343
http://dbpedia.org/resource/Wildwood_Catholic_High_School,Wildwood Catholic High School,190
http://dbpedia.org/resource/Salpointe_Catholic_High_School,Salpointe Catholic High School,1048
http://dbpedia.org/resource/Radyr_Comprehensive_School,Radyr Comprehensive School,1582
http://dbpedia.org/resource/Cağaloğlu_Anadolu_Lisesi,Cağaloğlu Anadolu Lisesi,757
http://dbpedia.org/resource/Eric_Hamber_Secondary_School,Eric Hamber Secondary School,1491
http://dbpedia.org/resource/Watson_Technology_Center,Watson Technology Center,556
"http://dbpedia.org/resource/Yavneh_Day_School_(Los_Gatos,_California)","Yavneh Day School (Los Gatos, California)",150
http://dbpedia.org/resource/Oshkosh_North_High_School,Oshkosh North High School,1150
http://dbpedia.org/resource/St._Paul_High_School_(Arkansas),St. Paul High School (Arkansas),104
http://dbpedia.org/resource/Crespi_Carmelite_High_School,Crespi Carmelite High School,540
http://dbpedia.org/resource/St._Theresa_Catholic_Secondary_School,St. Theresa Catholic Secondary School,648
http://dbpedia.org/resource/Irondale_High_School,Irondale High School,1721
http://dbpedia.org/resource/Shenfield_High_School,Shenfield High School,1293
http://dbpedia.org/resource/South_Bromsgrove_High_School,South Bromsgrove High School,330
http://dbpedia.org/resource/Stirling_High_School,Stirling High School,772
"http://dbpedia.org/resource/Emmanuel_College,_Gateshead","Emmanuel College, Gateshead",1423
http://dbpedia.org/resource/Wheaton_North_High_School,Wheaton North High School,2684
http://dbpedia.org/resource/Umatilla_High_School_(Oregon),Umatilla High School (Oregon),472
"http://dbpedia.org/resource/Bloomfield_High_School_(Bloomfield,_New_Mexico)","Bloomfield High School (Bloomfield, New Mexico)",756
http://dbpedia.org/resource/Pilot_Point_High_School,Pilot Point High School,525
http://dbpedia.org/resource/Cocoa_High_School,Cocoa High School,1257
http://dbpedia.org/resource/Barringer_High_School,Barringer High School,1415
http://dbpedia.org/resource/St._Paul_High_School_(Oregon),St. Paul High School (Oregon),105
http://dbpedia.org/resource/Fort_Zumwalt_North_High_School,Fort Zumwalt North High School,1350
http://dbpedia.org/resource/St._Timothy_High_School_(Cochrane),St. Timothy High School (Cochrane),314
"http://dbpedia.org/resource/St._Paul_High_School_(Shiner,_Texas)","St. Paul High School (Shiner, Texas)",122
"http://dbpedia.org/resource/St_Edward's_School,_Oxford","St Edward's School, Oxford",417
"http://dbpedia.org/resource/Lincoln_College,_Lincolnshire","Lincoln College, Lincolnshire",13613
"http://dbpedia.org/resource/Bowsher_High_School_(Toledo,_Ohio)","Bowsher High School (Toledo, Ohio)",1398
http://dbpedia.org/resource/Walker_Technology_College,Walker Technology College,946
http://dbpedia.org/resource/Immaculate_High_School,Immaculate High School,412
"http://dbpedia.org/resource/Waite_High_School_(Toledo,_Ohio)","Waite High School (Toledo, Ohio)",1557
http://dbpedia.org/resource/Savio_Salesian_College,Savio Salesian College,589
http://dbpedia.org/resource/Coginchaug_Regional_High_School,Coginchaug Regional High School,467
http://dbpedia.org/resource/Mount_Edgecumbe_High_School,Mount Edgecumbe High School,371
http://dbpedia.org/resource/Anna_High_School_(Ohio),Anna High School (Ohio),363
http://dbpedia.org/resource/Helix_High_School,Helix High School,2251
http://dbpedia.org/resource/Duncan_MacMillan_High_School,Duncan MacMillan High School,145
http://dbpedia.org/resource/Katella_High_School,Katella High School,2629
http://dbpedia.org/resource/The_Downs_Malvern,The Downs Malvern,173
http://dbpedia.org/resource/Montclair_High_School_(New_Jersey),Montclair High School (New Jersey),1535
http://dbpedia.org/resource/Valley_Christian_High_School_(Arizona),Valley Christian High School (Arizona),319
http://dbpedia.org/resource/Dixie_Grammar_School,Dixie Grammar School,350
http://dbpedia.org/resource/Skull_Valley_Elementary_School_District,Skull Valley Elementary School District,24
http://dbpedia.org/resource/Lord_Beaverbrook_High_School,Lord Beaverbrook High School,2012
http://dbpedia.org/resource/Groton-Dunstable_Regional_School_District,Groton-Dunstable Regional School District,1034
http://dbpedia.org/resource/Anchor_Bay_High_School,Anchor Bay High School,1874
http://dbpedia.org/resource/The_Leon_M._Goldstein_High_School_for_the_Sciences,The Leon M. Goldstein High School for the Sciences,960
http://dbpedia.org/resource/Benjamin_Elijah_Mays_High_School,Benjamin Elijah Mays High School,1864
http://dbpedia.org/resource/Riverside_School_District_(Pennsylvania),Riverside School District (Pennsylvania),1472
http://dbpedia.org/resource/SMT_Alor_Setar,SMT Alor Setar,627
http://dbpedia.org/resource/Adams_City_High_School,Adams City High School,1381
http://dbpedia.org/resource/Kenmore_West_Senior_High_School,Kenmore West Senior High School,1836
http://dbpedia.org/resource/North_Kingstown_High_School,North Kingstown High School,1303
http://dbpedia.org/resource/Reynoldsburg_High_School,Reynoldsburg High School,1803
http://dbpedia.org/resource/Cambridge_School_Noida,Cambridge School Noida,2768
http://dbpedia.org/resource/Conwell-Egan_Catholic_High_School,Conwell-Egan Catholic High School,541
http://dbpedia.org/resource/St._Xavier_High_School_(Louisville),St. Xavier High School (Louisville),1523
http://dbpedia.org/resource/Duchesne_Academy_of_the_Sacred_Heart_(Texas),Duchesne Academy of the Sacred Heart (Texas),723
http://dbpedia.org/resource/John_Whitgift_Academy,John Whitgift Academy,584
http://dbpedia.org/resource/Aldridge_School,Aldridge School,1552
http://dbpedia.org/resource/Midland_Park_High_School,Midland Park High School,487
http://dbpedia.org/resource/Lafayette_High_School_(Louisiana),Lafayette High School (Louisiana),2704
http://dbpedia.org/resource/Gloucester_High_School_(Ottawa),Gloucester High School (Ottawa),565
http://dbpedia.org/resource/St._John's_School_(Texas),St. John's School (Texas),1133
http://dbpedia.org/resource/Southern_High_School_(Guam),Southern High School (Guam),1418
http://dbpedia.org/resource/Johann-Wolfgang-von-Goethe-Gymnasium,Johann-Wolfgang-von-Goethe-Gymnasium,598
http://dbpedia.org/resource/Holland_Patent_High_School,Holland Patent High School,719
http://dbpedia.org/resource/Bangor_High_School_(Maine),Bangor High School (Maine),1460
http://dbpedia.org/resource/Sacramento_City_College,Sacramento City College,25801
http://dbpedia.org/resource/Macomb_Mathematics_Science_Technology_Center,Macomb Mathematics Science Technology Center,288
http://dbpedia.org/resource/Greenbank_High_School,Greenbank High School,837
http://dbpedia.org/resource/Louis_E._Dieruff_High_School,Louis E. Dieruff High School,1591
http://dbpedia.org/resource/Bridgwater_College_Academy,Bridgwater College Academy,1104
http://dbpedia.org/resource/Pigeon_Forge_High_School,Pigeon Forge High School,827
http://dbpedia.org/resource/Holy_Cross_of_San_Antonio,Holy Cross of San Antonio,393
http://dbpedia.org/resource/Al-Hijrah_School,Al-Hijrah School,613
http://dbpedia.org/resource/Marquette_University_High_School,Marquette University High School,967
http://dbpedia.org/resource/Marianas_High_School,Marianas High School,1242
http://dbpedia.org/resource/Denbigh_School,Denbigh School,1612
http://dbpedia.org/resource/Neshaminy_High_School,Neshaminy High School,2823
http://dbpedia.org/resource/Worland_High_School,Worland High School,424
http://dbpedia.org/resource/Ephrata_High_School_(Pennsylvania),Ephrata High School (Pennsylvania),1396
http://dbpedia.org/resource/James_Allen's_Girls'_School,James Allen's Girls' School,1042
http://dbpedia.org/resource/Alliance_Charter_Academy,Alliance Charter Academy,222
http://dbpedia.org/resource/Palm_Harbor_University_High_School,Palm Harbor University High School,2622
http://dbpedia.org/resource/Dingwall_Academy,Dingwall Academy,1171
"http://dbpedia.org/resource/Sacred_Heart_High_School,_Hammersmith","Sacred Heart High School, Hammersmith",950
http://dbpedia.org/resource/Centennial_Collegiate,Centennial Collegiate,1084
http://dbpedia.org/resource/Stevens_High_School_(South_Dakota),Stevens High School (South Dakota),1609
http://dbpedia.org/resource/John_W._North_High_School,John W. North High School,2616
http://dbpedia.org/resource/Bureau_Valley_High_School,Bureau Valley High School,385
http://dbpedia.org/resource/Lowpoint-Washburn_High_School,Lowpoint-Washburn High School,159
http://dbpedia.org/resource/Washington_High_School_(West_Virginia),Washington High School (West Virginia),1243
"http://dbpedia.org/resource/Santa_Fe_High_School_(Alachua,_Florida)","Santa Fe High School (Alachua, Florida)",940
http://dbpedia.org/resource/Cypress_Woods_High_School,Cypress Woods High School,3686
http://dbpedia.org/resource/New_Bedford_High_School,New Bedford High School,1855
http://dbpedia.org/resource/Dover_High_School_(Delaware),Dover High School (Delaware),1256
"http://dbpedia.org/resource/Manchester_High_School_(North_Manchester,_Indiana)","Manchester High School (North Manchester, Indiana)",645
http://dbpedia.org/resource/Waldport_High_School,Waldport High School,200
"http://dbpedia.org/resource/Sherman_Junior/Senior_High_School_(Moro,_Oregon)","Sherman Junior/Senior High School (Moro, Oregon)",123
http://dbpedia.org/resource/A._B._Miller_High_School,A. B. Miller High School,2672
http://dbpedia.org/resource/Pleckgate_High_School,Pleckgate High School,1213
http://dbpedia.org/resource/Prince_George_High_School,Prince George High School,1320
"http://dbpedia.org/resource/DeSales_High_School_(Louisville,_Kentucky)","DeSales High School (Louisville, Kentucky)",334
"http://dbpedia.org/resource/Miras_International_School,_Almaty","Miras International School, Almaty",641
http://dbpedia.org/resource/Hebrew_High_School_of_New_England,Hebrew High School of New England,50
"http://dbpedia.org/resource/Notre_Dame_Preparatory_School_(Towson,_Maryland)","Notre Dame Preparatory School (Towson, Maryland)",661
http://dbpedia.org/resource/Galva_High_School,Galva High School,156
http://dbpedia.org/resource/Belgrade-Brooten-Elrosa_High_School,Belgrade-Brooten-Elrosa High School,372
http://dbpedia.org/resource/Covina_High_School,Covina High School,1798
http://dbpedia.org/resource/East_Clinton_High_School,East Clinton High School,503
http://dbpedia.org/resource/Edward_Sheerien_School,Edward Sheerien School,943
http://dbpedia.org/resource/Tug_Valley_High_School,Tug Valley High School,393
http://dbpedia.org/resource/Mattawan_High_School,Mattawan High School,1110
http://dbpedia.org/resource/Buffalo_Seminary,Buffalo Seminary,257
http://dbpedia.org/resource/Brawley_Union_High_School,Brawley Union High School,1718
"http://dbpedia.org/resource/Santa_Clara_High_School_(Santa_Clara,_California)","Santa Clara High School (Santa Clara, California)",1646
http://dbpedia.org/resource/George_Washington_University_Law_School,George Washington University Law School,233
http://dbpedia.org/resource/Touro_College_of_Osteopathic_Medicine,Touro College of Osteopathic Medicine,473
http://dbpedia.org/resource/Montgomery_High_School_(New_Jersey),Montgomery High School (New Jersey),1620
http://dbpedia.org/resource/Southern_High_School_(Harwood),Southern High School (Harwood),1039
http://dbpedia.org/resource/Lexington_Catholic_High_School,Lexington Catholic High School,816
http://dbpedia.org/resource/Johnson_Central_High_School,Johnson Central High School,1216
"http://dbpedia.org/resource/St_Peter's_School,_Huntingdon","St Peter's School, Huntingdon",1229
http://dbpedia.org/resource/Station_Camp_High_School,Station Camp High School,1790
http://dbpedia.org/resource/Smithdon_High_School,Smithdon High School,1219
http://dbpedia.org/resource/Seaquam_Secondary_School,Seaquam Secondary School,1340
http://dbpedia.org/resource/Wake_Forest_School_of_Medicine,Wake Forest School of Medicine,13
http://dbpedia.org/resource/The_Red_Maids'_School,The Red Maids' School,533
http://dbpedia.org/resource/East_Grand_Rapids_High_School,East Grand Rapids High School,972
http://dbpedia.org/resource/Londonderry_High_School,Londonderry High School,2183
http://dbpedia.org/resource/Lady_Margaret_School,Lady Margaret School,558
"http://dbpedia.org/resource/All_Hallows_Catholic_College,_Macclesfield","All Hallows Catholic College, Macclesfield",1145
http://dbpedia.org/resource/Carroll_County_School_District_(Georgia),Carroll County School District (Georgia),11220
http://dbpedia.org/resource/Fangchanupathum_School,Fangchanupathum School,1498
http://dbpedia.org/resource/Chaminade-Madonna_College_Preparatory_School,Chaminade-Madonna College Preparatory School,504
http://dbpedia.org/resource/Roundhay_School,Roundhay School,2026
http://dbpedia.org/resource/Aquinas_High_School_(California),Aquinas High School (California),423
http://dbpedia.org/resource/Steinbrenner_High_School,Steinbrenner High School,2243
http://dbpedia.org/resource/University_of_Santo_Tomas_College_of_Commerce_and_Business_Administration,University of Santo Tomas College of Commerce and Business Administration,4755
http://dbpedia.org/resource/Seventy-First_High_School,Seventy-First High School,1792
http://dbpedia.org/resource/Southwood_Middle_School,Southwood Middle School,1351
"http://dbpedia.org/resource/Frederick_Douglass_High_School_(Columbia,_Missouri)","Frederick Douglass High School (Columbia, Missouri)",96
http://dbpedia.org/resource/James_Madison_High_School_(Dallas),James Madison High School (Dallas),382
http://dbpedia.org/resource/Broadlands_Academy,Broadlands Academy,405
http://dbpedia.org/resource/Central_Huron_Secondary_School,Central Huron Secondary School,615
http://dbpedia.org/resource/Fort_Collins_High_School,Fort Collins High School,1951
http://dbpedia.org/resource/Chicago_Math_and_Science_Academy,Chicago Math and Science Academy,556
http://dbpedia.org/resource/Tartan_Senior_High_School,Tartan Senior High School,2278
http://dbpedia.org/resource/Penncrest_High_School,Penncrest High School,1297
http://dbpedia.org/resource/George_Spencer_Academy,George Spencer Academy,1218
http://dbpedia.org/resource/Lycée_français_de_Pondichéry,Lycée français de Pondichéry,1433
http://dbpedia.org/resource/Cook_County_School_District,Cook County School District,3195
"http://dbpedia.org/resource/Pacific_High_School_(Sitka,_Alaska)","Pacific High School (Sitka, Alaska)",21
http://dbpedia.org/resource/South_Garland_High_School,South Garland High School,2214
http://dbpedia.org/resource/Mountain_Brook_School_System,Mountain Brook School System,4397
http://dbpedia.org/resource/Drapers'_Academy,Drapers' Academy,655
http://dbpedia.org/resource/Westridge_High_School,Westridge High School,313
http://dbpedia.org/resource/St._Paul_Academy_and_Summit_School,St. Paul Academy and Summit School,4645
http://dbpedia.org/resource/Labour_India_Gurukulam_Public_School,Labour India Gurukulam Public School,1363
http://dbpedia.org/resource/The_Sharon_Academy,The Sharon Academy,137
http://dbpedia.org/resource/Hawthorne_Christian_Academy,Hawthorne Christian Academy,437
http://dbpedia.org/resource/Henley_College_Coventry,Henley College Coventry,6001
http://dbpedia.org/resource/Hallmark_Institute_of_Photography,Hallmark Institute of Photography,61
http://dbpedia.org/resource/Midlands_Christian_College,Midlands Christian College,455
http://dbpedia.org/resource/Minot_High_School,Minot High School,2343
http://dbpedia.org/resource/Todmorden_High_School,Todmorden High School,768
http://dbpedia.org/resource/Rosendale_Primary_School,Rosendale Primary School,478
http://dbpedia.org/resource/King_Edward_VI_Camp_Hill_School_for_Boys,King Edward VI Camp Hill School for Boys,680
"http://dbpedia.org/resource/Bishop_Watterson_High_School_(Columbus,_Ohio)","Bishop Watterson High School (Columbus, Ohio)",1189
http://dbpedia.org/resource/Newark_Memorial_High_School,Newark Memorial High School,1769
http://dbpedia.org/resource/North_County_High_School_(Missouri),North County High School (Missouri),908
http://dbpedia.org/resource/Portage_Northern_High_School,Portage Northern High School,1415
http://dbpedia.org/resource/Alameda_Community_Learning_Center,Alameda Community Learning Center,391
http://dbpedia.org/resource/Clarksville_Senior_High_School,Clarksville Senior High School,454
http://dbpedia.org/resource/William_Aberhart_High_School,William Aberhart High School,1749
http://dbpedia.org/resource/Anderson_County_High_School_(Kentucky),Anderson County High School (Kentucky),1292
http://dbpedia.org/resource/Lakeview_Christian_High_School,Lakeview Christian High School,175
http://dbpedia.org/resource/Immaculate_Heart_High_School_(Los_Angeles),Immaculate Heart High School (Los Angeles),519
http://dbpedia.org/resource/Emanuel_County_School_District,Emanuel County School District,4967
http://dbpedia.org/resource/Shorecrest_High_School,Shorecrest High School,1184
http://dbpedia.org/resource/St._Mary's_Springs_Academy,St. Mary's Springs Academy,950
http://dbpedia.org/resource/Barton_Peveril_Sixth_Form_College,Barton Peveril Sixth Form College,4247
"http://dbpedia.org/resource/East_High_School_(Pueblo,_Colorado)","East High School (Pueblo, Colorado)",917
http://dbpedia.org/resource/Don_Bosco_Technical_Institute,Don Bosco Technical Institute,435
http://dbpedia.org/resource/Konkuk_University_Law_School,Konkuk University Law School,114
http://dbpedia.org/resource/Breeks_Memorial_School,Breeks Memorial School,797
http://dbpedia.org/resource/Sandy_Spring_Friends_School,Sandy Spring Friends School,624
http://dbpedia.org/resource/Roswell_High_School_(Georgia),Roswell High School (Georgia),1867
http://dbpedia.org/resource/Trinity_School_(New_York_City),Trinity School (New York City),858
