http://dbpedia.org/ontology/School,School,http://dbpedia.org/ontology/numberOfStudents
http://dbpedia.org/resource/Harrison_Central_High_School_(Mississippi),Harrison Central High School (Mississippi),1787
http://dbpedia.org/resource/Fred_J._Page_High_School,Fred J. Page High School,812
http://dbpedia.org/resource/Plainville_High_School,Plainville High School,734
http://dbpedia.org/resource/Yeshivah_of_Flatbush,Yeshivah of Flatbush,10071
"http://dbpedia.org/resource/Buena_Vista_High_School_(Buena_Vista,_Colorado)","Buena Vista High School (Buena Vista, Colorado)",292
http://dbpedia.org/resource/New_Kent_High_School,New Kent High School,911
http://dbpedia.org/resource/Barrow_High_School,Barrow High School,233
"http://dbpedia.org/resource/Al-Hilal_English_School,_Manki","Al-Hilal English School, Manki",380
http://dbpedia.org/resource/Meden_School,Meden School,806
http://dbpedia.org/resource/Iowa_School_for_the_Deaf,Iowa School for the Deaf,117
http://dbpedia.org/resource/Tucson_High_Magnet_School,Tucson High Magnet School,2589
http://dbpedia.org/resource/Armwood_High_School,Armwood High School,2135
http://dbpedia.org/resource/Brockton_High_School,Brockton High School,4793
"http://dbpedia.org/resource/John_F._Kennedy_High_School_(Warren,_Ohio)","John F. Kennedy High School (Warren, Ohio)",293
http://dbpedia.org/resource/Bankura_Zilla_School,Bankura Zilla School,848
http://dbpedia.org/resource/Austin_Area_School_District,Austin Area School District,245
http://dbpedia.org/resource/New_Hyde_Park_Memorial_High_School,New Hyde Park Memorial High School,1394
http://dbpedia.org/resource/L'École_Arménienne_Sourp_Hagop,L'École Arménienne Sourp Hagop,714
http://dbpedia.org/resource/Bridgetown_Regional_High_School,Bridgetown Regional High School,379
"http://dbpedia.org/resource/St_Thomas_More_Catholic_School,_Bedford","St Thomas More Catholic School, Bedford",693
"http://dbpedia.org/resource/Jawahar_Navodaya_Vidyalaya,_Indore","Jawahar Navodaya Vidyalaya, Indore",391
http://dbpedia.org/resource/Saint_Louis_Park_High_School,Saint Louis Park High School,9
"http://dbpedia.org/resource/Presentation_College,_Bray","Presentation College, Bray",627
http://dbpedia.org/resource/Chippewa_Falls_High_School,Chippewa Falls High School,1561
http://dbpedia.org/resource/St._John's_Diocesan_School_for_Girls,St. John's Diocesan School for Girls,451
"http://dbpedia.org/resource/Washington_High_School_(Portland,_Oregon)","Washington High School (Portland, Oregon)",1476
http://dbpedia.org/resource/Childs_Way_Charter_School,Childs Way Charter School,41
"http://dbpedia.org/resource/Hidden_Valley_High_School_(Grants_Pass,_Oregon)","Hidden Valley High School (Grants Pass, Oregon)",764
http://dbpedia.org/resource/Peninsula_High_School_(San_Bruno),Peninsula High School (San Bruno),245
"http://dbpedia.org/resource/Unity_High_School_(Mendon,_Illinois)","Unity High School (Mendon, Illinois)",161
"http://dbpedia.org/resource/Loreto_College,_Mullingar","Loreto College, Mullingar",791
http://dbpedia.org/resource/Glynn_Academy,Glynn Academy,2003
http://dbpedia.org/resource/Saint_Francis_D'Assisi_High_School,Saint Francis D'Assisi High School,8599
http://dbpedia.org/resource/Fairfield_Ludlowe_High_School,Fairfield Ludlowe High School,1607
http://dbpedia.org/resource/Midd-West_School_District,Midd-West School District,2072
http://dbpedia.org/resource/Bedok_Green_Secondary_School,Bedok Green Secondary School,1168
http://dbpedia.org/resource/Citadel_High_School,Citadel High School,1043
http://dbpedia.org/resource/Academy_of_Our_Lady_(Louisiana),Academy of Our Lady (Louisiana),622
http://dbpedia.org/resource/Newlands_Girls'_School,Newlands Girls' School,1042
http://dbpedia.org/resource/QSI_International_School_of_Dushanbe,QSI International School of Dushanbe,79
http://dbpedia.org/resource/West_Lane_Technology_Learning_Center,West Lane Technology Learning Center,83
http://dbpedia.org/resource/Deptford_Green_School,Deptford Green School,978
http://dbpedia.org/resource/Junction_City_High_School_(Arkansas),Junction City High School (Arkansas),248
http://dbpedia.org/resource/San_Marino_High_School,San Marino High School,1411
http://dbpedia.org/resource/Malden_High_School_(Missouri),Malden High School (Missouri),465
http://dbpedia.org/resource/Crisp_County_School_District,Crisp County School District,4538
"http://dbpedia.org/resource/St_Augustine's_Priory,_Ealing","St Augustine's Priory, Ealing",489
"http://dbpedia.org/resource/Highland_Middle_School_(Louisville,_Kentucky)","Highland Middle School (Louisville, Kentucky)",1941
"http://dbpedia.org/resource/Capital_High_School,_Bhubaneswar","Capital High School, Bhubaneswar",996
http://dbpedia.org/resource/North_Cambridge_Academy,North Cambridge Academy,484
http://dbpedia.org/resource/Coeur_d'Alene_High_School,Coeur d'Alene High School,1402
"http://dbpedia.org/resource/Creekview_High_School_(Carrollton,_Texas)","Creekview High School (Carrollton, Texas)",2335
http://dbpedia.org/resource/Llanishen_High_School,Llanishen High School,1617
http://dbpedia.org/resource/Rogers_High_School_(Arkansas),Rogers High School (Arkansas),1744
http://dbpedia.org/resource/Perry_High_School_(Georgia),Perry High School (Georgia),1182
http://dbpedia.org/resource/Durant_High_School_(Iowa),Durant High School (Iowa),286
http://dbpedia.org/resource/Bellarmine-Jefferson_High_School,Bellarmine-Jefferson High School,217
http://dbpedia.org/resource/Decatur_Public_Schools,Decatur Public Schools,1061
http://dbpedia.org/resource/North_Warren_Central_School,North Warren Central School,625
http://dbpedia.org/resource/Wadham_School,Wadham School,624
http://dbpedia.org/resource/Ansar_English_School,Ansar English School,4361
http://dbpedia.org/resource/Randolph_High_School_(Massachusetts),Randolph High School (Massachusetts),665
http://dbpedia.org/resource/Bob_Jones_High_School,Bob Jones High School,2167
http://dbpedia.org/resource/Southwestern_Randolph_High_School,Southwestern Randolph High School,1159
http://dbpedia.org/resource/Ormiston_Maritime_Academy,Ormiston Maritime Academy,1110
http://dbpedia.org/resource/Bloomfield_High_School_(Connecticut),Bloomfield High School (Connecticut),604
http://dbpedia.org/resource/Ashton_Park_School,Ashton Park School,1050
http://dbpedia.org/resource/Jacobs_High_School,Jacobs High School,2472
http://dbpedia.org/resource/Dayville_School,Dayville School,52
http://dbpedia.org/resource/Pelangi_Kasih_School,Pelangi Kasih School,1634
http://dbpedia.org/resource/Robert_McQueen_High_School,Robert McQueen High School,1783
http://dbpedia.org/resource/Skyline_High_School_(Utah),Skyline High School (Utah),1585
http://dbpedia.org/resource/St_Francis_of_Assisi_Catholic_Technology_College,St Francis of Assisi Catholic Technology College,926
http://dbpedia.org/resource/Jefferson_City_School_District,Jefferson City School District,1717
http://dbpedia.org/resource/Barnwell_School,Barnwell School,1846
http://dbpedia.org/resource/Tolworth_Girls'_School,Tolworth Girls' School,1162
"http://dbpedia.org/resource/Stanborough_School,_Watford","Stanborough School, Watford",250
http://dbpedia.org/resource/Access_International_Academy_Ningbo,Access International Academy Ningbo,167
http://dbpedia.org/resource/Linganore_High_School,Linganore High School,1439
http://dbpedia.org/resource/The_Crossley_Heath_School,The Crossley Heath School,1184
http://dbpedia.org/resource/Middle_College_High_School_at_DTCC,Middle College High School at DTCC,98
"http://dbpedia.org/resource/Cleveland_High_School_(Los_Angeles,_California)","Cleveland High School (Los Angeles, California)",4499
"http://dbpedia.org/resource/Greenwood_Academy,_Birmingham","Greenwood Academy, Birmingham",974
http://dbpedia.org/resource/Willes_Little_Flower_School,Willes Little Flower School,16032
http://dbpedia.org/resource/Bernice_MacNaughton_High_School,Bernice MacNaughton High School,989
http://dbpedia.org/resource/Orange_High_School_(Ohio),Orange High School (Ohio),789
http://dbpedia.org/resource/Phoenix_Christian_Preparatory_School,Phoenix Christian Preparatory School,368
http://dbpedia.org/resource/Collegiate_School_(New_York_City),Collegiate School (New York City),616
http://dbpedia.org/resource/Bartlesville_High_School,Bartlesville High School,869
http://dbpedia.org/resource/Cigarroa_High_School,Cigarroa High School,1176
http://dbpedia.org/resource/Sylvia_Young_Theatre_School,Sylvia Young Theatre School,219
"http://dbpedia.org/resource/Pittsburgh_Milliones,_University_Preparatory_School","Pittsburgh Milliones, University Preparatory School",537
http://dbpedia.org/resource/San_Francisco_Day_School,San Francisco Day School,433
http://dbpedia.org/resource/H._L._Bourgeois_High_School,H. L. Bourgeois High School,1671
http://dbpedia.org/resource/Philippine_Science_High_School_Eastern_Visayas_Campus,Philippine Science High School Eastern Visayas Campus,283
http://dbpedia.org/resource/Coldwater_High_School_(Ohio),Coldwater High School (Ohio),577
http://dbpedia.org/resource/Grafton_High_School_(Virginia),Grafton High School (Virginia),1231
http://dbpedia.org/resource/Archbishop_Ryan_High_School,Archbishop Ryan High School,1285
"http://dbpedia.org/resource/Carthage_Senior_High_School_(Carthage,_New_York)","Carthage Senior High School (Carthage, New York)",853
http://dbpedia.org/resource/International_School_of_Kraków,International School of Kraków,270
http://dbpedia.org/resource/The_Gregg_School,The Gregg School,301
http://dbpedia.org/resource/SBOA_School_&_Junior_College,SBOA School & Junior College,11033
http://dbpedia.org/resource/Faith_Heritage_School,Faith Heritage School,299
"http://dbpedia.org/resource/Midland_High_School_(Midland,_Texas)","Midland High School (Midland, Texas)",2831
http://dbpedia.org/resource/Green_Bay_Southwest_High_School,Green Bay Southwest High School,1463
http://dbpedia.org/resource/Greater_Nanticoke_Area_School_District,Greater Nanticoke Area School District,2062
http://dbpedia.org/resource/St._Ann's_Academy_(Kamloops),St. Ann's Academy (Kamloops),628
http://dbpedia.org/resource/South_Shore_High_School_(Chicago),South Shore High School (Chicago),491
http://dbpedia.org/resource/Somerset_High_School_(Texas),Somerset High School (Texas),1068
http://dbpedia.org/resource/Wauconda_High_School,Wauconda High School,1515
http://dbpedia.org/resource/Gymnasium_9_(Simferopol),Gymnasium 9 (Simferopol),743
http://dbpedia.org/resource/Woodrow_Wilson_High_School_(Dallas),Woodrow Wilson High School (Dallas),1717
http://dbpedia.org/resource/William_Edwards_School,William Edwards School,1180
http://dbpedia.org/resource/Longridge_Towers_School,Longridge Towers School,248
http://dbpedia.org/resource/Inverness_High_School,Inverness High School,403
"http://dbpedia.org/resource/Bishop_Kearney_High_School_(Irondequoit,_New_York)","Bishop Kearney High School (Irondequoit, New York)",406
http://dbpedia.org/resource/St._Mary_Catholic_Central_High_School,St. Mary Catholic Central High School,347
http://dbpedia.org/resource/Leeds_College_of_Building,Leeds College of Building,6102
http://dbpedia.org/resource/Calhoun_High_School_(Illinois),Calhoun High School (Illinois),172
http://dbpedia.org/resource/Loyola_University_Chicago_School_of_Law,Loyola University Chicago School of Law,864
http://dbpedia.org/resource/Concord_High_School_(New_Hampshire),Concord High School (New Hampshire),1531
http://dbpedia.org/resource/Sunny_Hills_High_School,Sunny Hills High School,2215
http://dbpedia.org/resource/Northeast_High_School_(Louisiana),Northeast High School (Louisiana),645
http://dbpedia.org/resource/Pitsford_School,Pitsford School,421
http://dbpedia.org/resource/Our_Lady_of_Mercy_Academy_(New_York),Our Lady of Mercy Academy (New York),536
http://dbpedia.org/resource/St_Aloysius'_College_(Malta),St Aloysius' College (Malta),1047
http://dbpedia.org/resource/Western_Pennsylvania_School_for_the_Deaf,Western Pennsylvania School for the Deaf,213
http://dbpedia.org/resource/Newark_Tech_High_School,Newark Tech High School,808
http://dbpedia.org/resource/Aquinas_High_School_(New_York),Aquinas High School (New York),682
http://dbpedia.org/resource/Eureka_High_School_(Missouri),Eureka High School (Missouri),1563
http://dbpedia.org/resource/Roosevelt_High_School_(Oregon),Roosevelt High School (Oregon),811
"http://dbpedia.org/resource/Abbey_College,_Malvern","Abbey College, Malvern",100
http://dbpedia.org/resource/Sejong_Science_High_School,Sejong Science High School,396
"http://dbpedia.org/resource/Washington_High_School_(South_Bend,_Indiana)","Washington High School (South Bend, Indiana)",958
http://dbpedia.org/resource/Bemidji_High_School,Bemidji High School,1592
http://dbpedia.org/resource/Triton_High_School_(North_Carolina),Triton High School (North Carolina),1266
http://dbpedia.org/resource/St._John's_Preparatory_School_(Massachusetts),St. John's Preparatory School (Massachusetts),1521
"http://dbpedia.org/resource/Walnut_Hills_High_School_(Cincinnati,_Ohio)","Walnut Hills High School (Cincinnati, Ohio)",2354
http://dbpedia.org/resource/Queensmount_Public_School,Queensmount Public School,514
http://dbpedia.org/resource/Lloyd_Memorial_High_School,Lloyd Memorial High School,580
http://dbpedia.org/resource/Athens_High_School_(Texas),Athens High School (Texas),894
http://dbpedia.org/resource/Bogdan_Petriceicu_Hasdeu_National_College,Bogdan Petriceicu Hasdeu National College,1409
http://dbpedia.org/resource/ISG_Dammam,ISG Dammam,1407
http://dbpedia.org/resource/Waldo_J._Wood_Memorial_Jr/Sr_High_School,Waldo J. Wood Memorial Jr/Sr High School,350
http://dbpedia.org/resource/South_Charleston_High_School,South Charleston High School,997
http://dbpedia.org/resource/Westmoor_High_School,Westmoor High School,1888
http://dbpedia.org/resource/National_San_Chung_Senior_High_School,National San Chung Senior High School,2115
http://dbpedia.org/resource/University_of_Freiburg_Faculty_of_Medicine,University of Freiburg Faculty of Medicine,455
http://dbpedia.org/resource/Ferndale_Area_School_District,Ferndale Area School District,810
http://dbpedia.org/resource/Georg-Cantor-Gymnasium,Georg-Cantor-Gymnasium,500
http://dbpedia.org/resource/Bangladesh_MHM_School_&_College,Bangladesh MHM School & College,1027
http://dbpedia.org/resource/Somerset_Area_School_District,Somerset Area School District,2048
http://dbpedia.org/resource/Thornleigh_Salesian_College,Thornleigh Salesian College,1489
http://dbpedia.org/resource/Institut_Polytechnique_des_Sciences_Avancées,Institut Polytechnique des Sciences Avancées,1733
http://dbpedia.org/resource/Olympus_High_School,Olympus High School,1726
http://dbpedia.org/resource/River_Valley_High_School_(Arizona),River Valley High School (Arizona),765
http://dbpedia.org/resource/Reading_School_District,Reading School District,19464
http://dbpedia.org/resource/Bhawani_Dayal_Arya_College,Bhawani Dayal Arya College,958
http://dbpedia.org/resource/Mount_Tabor_High_School,Mount Tabor High School,1471
http://dbpedia.org/resource/Quince_Orchard_High_School,Quince Orchard High School,1604
http://dbpedia.org/resource/St._Mary's_Anglo-Indian_Higher_Secondary_School,St. Mary's Anglo-Indian Higher Secondary School,1631
http://dbpedia.org/resource/Thompson_Valley_High_School,Thompson Valley High School,1702
http://dbpedia.org/resource/North_Providence_High_School,North Providence High School,1403
"http://dbpedia.org/resource/St_Paul's_Catholic_School,_Milton_Keynes","St Paul's Catholic School, Milton Keynes",1467
http://dbpedia.org/resource/Leolo_High_School,Leolo High School,485
http://dbpedia.org/resource/Charlotte_Country_Day_School,Charlotte Country Day School,1517
http://dbpedia.org/resource/Ullens_School,Ullens School,857
http://dbpedia.org/resource/Greene's_Tutorial_College,Greene's Tutorial College,348
http://dbpedia.org/resource/Robinson_High_School_(Texas),Robinson High School (Texas),509
http://dbpedia.org/resource/Stoke_Brunswick_School,Stoke Brunswick School,150
http://dbpedia.org/resource/Stuarts_Draft_High_School,Stuarts Draft High School,700
http://dbpedia.org/resource/Westside_Christian_High_School,Westside Christian High School,242
http://dbpedia.org/resource/Ceres_High_School,Ceres High School,1717
http://dbpedia.org/resource/South_Broward_High_School,South Broward High School,3238
http://dbpedia.org/resource/Lakes_High_School,Lakes High School,1310
http://dbpedia.org/resource/Westview_High_School_(San_Diego),Westview High School (San Diego),1922
http://dbpedia.org/resource/Regional_Science_High_School_Union,Regional Science High School Union,4859
"http://dbpedia.org/resource/The_King_Alfred_School,_Highbridge","The King Alfred School, Highbridge",1368
"http://dbpedia.org/resource/Lake_Zurich_High_School_(Lake_Zurich,_Illinois)","Lake Zurich High School (Lake Zurich, Illinois)",2285
http://dbpedia.org/resource/Charlotte_High_School_(Michigan),Charlotte High School (Michigan),777
http://dbpedia.org/resource/Herriman_High_School,Herriman High School,2130
http://dbpedia.org/resource/Eisenhower_High_School_(Houston),Eisenhower High School (Houston),3761
http://dbpedia.org/resource/Carrick_Academy,Carrick Academy,544
"http://dbpedia.org/resource/Jesuit_High_School_(Beaverton,_Oregon)","Jesuit High School (Beaverton, Oregon)",1284
http://dbpedia.org/resource/Farwell_High_School,Farwell High School,148
"http://dbpedia.org/resource/The_Forest_School,_Winnersh","The Forest School, Winnersh",1359
"http://dbpedia.org/resource/Gandhi_Smarak_Inter_College,_Rajesultanpur","Gandhi Smarak Inter College, Rajesultanpur",5534
http://dbpedia.org/resource/Wellingborough_School,Wellingborough School,964
http://dbpedia.org/resource/Frații_Buzești_National_College,Frații Buzești National College,2154
http://dbpedia.org/resource/Richard_J._Reynolds_High_School,Richard J. Reynolds High School,1646
http://dbpedia.org/resource/President_Kennedy_School_and_Community_College,President Kennedy School and Community College,1040
http://dbpedia.org/resource/Grove_City_High_School,Grove City High School,1891
http://dbpedia.org/resource/Academy_for_Information_Technology,Academy for Information Technology,230
"http://dbpedia.org/resource/Bear_Creek_High_School_(Lakewood,_Colorado)","Bear Creek High School (Lakewood, Colorado)",1959
http://dbpedia.org/resource/Eastdale_Collegiate_and_Vocational_Institute,Eastdale Collegiate and Vocational Institute,1335
http://dbpedia.org/resource/SMK_Puteri,SMK Puteri,1488
http://dbpedia.org/resource/Kenmore_High_School,Kenmore High School,667
http://dbpedia.org/resource/Ensweiler_Academy,Ensweiler Academy,75
http://dbpedia.org/resource/Loganville_High_School,Loganville High School,2120
http://dbpedia.org/resource/Great_Marlow_School,Great Marlow School,1453
http://dbpedia.org/resource/Falcon_College,Falcon College,371
http://dbpedia.org/resource/Dutchtown_High_School_(Louisiana),Dutchtown High School (Louisiana),2483
http://dbpedia.org/resource/New_Heys_Comprehensive_School,New Heys Comprehensive School,954
http://dbpedia.org/resource/Timpanogos_High_School,Timpanogos High School,1508
http://dbpedia.org/resource/Kelly_Road_Secondary_School,Kelly Road Secondary School,1252
"http://dbpedia.org/resource/Westfield_Academy,_Yeovil","Westfield Academy, Yeovil",914
"http://dbpedia.org/resource/Loreto_College,_Coleraine","Loreto College, Coleraine",854
http://dbpedia.org/resource/North_Farmington_High_School,North Farmington High School,1173
http://dbpedia.org/resource/Pilot_Rock_High_School,Pilot Rock High School,239
http://dbpedia.org/resource/Moorpark_High_School,Moorpark High School,2274
http://dbpedia.org/resource/Albert_Gallatin_Area_School_District,Albert Gallatin Area School District,3872
"http://dbpedia.org/resource/St._Mary's_School,_Kuala_Lumpur","St. Mary's School, Kuala Lumpur",1154
http://dbpedia.org/resource/Garfield_High_School_(California),Garfield High School (California),3885
http://dbpedia.org/resource/Kern_Valley_High_School,Kern Valley High School,438
http://dbpedia.org/resource/Eau_Gallie_High_School,Eau Gallie High School,7
http://dbpedia.org/resource/Roedean_School_(South_Africa),Roedean School (South Africa),801
http://dbpedia.org/resource/Watertown_High_School_(New_York),Watertown High School (New York),1116
http://dbpedia.org/resource/Caddo_Mills_High_School,Caddo Mills High School,429
http://dbpedia.org/resource/St._Jude_Educational_Institute,St. Jude Educational Institute,186
http://dbpedia.org/resource/Groveton_High_School_(Texas),Groveton High School (Texas),370
http://dbpedia.org/resource/Plano_East_Senior_High_School,Plano East Senior High School,2976
http://dbpedia.org/resource/Colony_High_School,Colony High School,2141
http://dbpedia.org/resource/Prout_School,Prout School,539
http://dbpedia.org/resource/Rydens_Enterprise_School,Rydens Enterprise School,1370
http://dbpedia.org/resource/Kalinga_Polytechnic,Kalinga Polytechnic,1181
http://dbpedia.org/resource/Ashley_Hall_(school),Ashley Hall (school),618
"http://dbpedia.org/resource/Alexander-von-Humboldt-Gymnasium,_Konstanz","Alexander-von-Humboldt-Gymnasium, Konstanz",1102
http://dbpedia.org/resource/Fay_School,Fay School,511
http://dbpedia.org/resource/Shantou_Experimental_School,Shantou Experimental School,2426
http://dbpedia.org/resource/Mount_Carmel_High_School_(Chicago),Mount Carmel High School (Chicago),883
http://dbpedia.org/resource/Belle_Vernon_Area_School_District,Belle Vernon Area School District,2763
http://dbpedia.org/resource/Ilford_County_High_School,Ilford County High School,858
http://dbpedia.org/resource/Greencastle-Antrim_School_District,Greencastle-Antrim School District,2799
http://dbpedia.org/resource/Juniata_County_School_District,Juniata County School District,3213
http://dbpedia.org/resource/CCC_Heep_Woh_College,CCC Heep Woh College,1201
http://dbpedia.org/resource/St._Austin_Catholic_School,St. Austin Catholic School,218
http://dbpedia.org/resource/Bermudian_Springs_School_District,Bermudian Springs School District,1874
http://dbpedia.org/resource/Huffman_High_School,Huffman High School,1059
http://dbpedia.org/resource/Helsby_High_School,Helsby High School,1476
http://dbpedia.org/resource/Toronto_Japanese_School,Toronto Japanese School,532
http://dbpedia.org/resource/Madera_High_School,Madera High School,2244
"http://dbpedia.org/resource/Hamilton_High_School_(Hamilton,_Alabama)","Hamilton High School (Hamilton, Alabama)",476
http://dbpedia.org/resource/École_supérieure_d'études_cinématographiques,École supérieure d'études cinématographiques,360
http://dbpedia.org/resource/Spencerville_High_School_(Ohio),Spencerville High School (Ohio),1149
http://dbpedia.org/resource/Mount_St._Mary_High_School_(Oklahoma),Mount St. Mary High School (Oklahoma),411
http://dbpedia.org/resource/Chinese_Community_Centre,Chinese Community Centre,2856
http://dbpedia.org/resource/Charlotte_United_Christian_Academy,Charlotte United Christian Academy,178
http://dbpedia.org/resource/Katharine_Lady_Berkeley's_School,Katharine Lady Berkeley's School,1331
http://dbpedia.org/resource/Applewild_School,Applewild School,191
http://dbpedia.org/resource/Worthing_High_School_(Houston),Worthing High School (Houston),756
http://dbpedia.org/resource/Maine_Central_Institute,Maine Central Institute,307
http://dbpedia.org/resource/El_Camino_High_School_(South_San_Francisco),El Camino High School (South San Francisco),1488
http://dbpedia.org/resource/Rawls_College_of_Business,Rawls College of Business,4665
http://dbpedia.org/resource/Lanier_Middle_School_(Houston),Lanier Middle School (Houston),1421
http://dbpedia.org/resource/Lake_Ridge_Schools_Corporation,Lake Ridge Schools Corporation,2131
http://dbpedia.org/resource/Litherland_High_School,Litherland High School,788
http://dbpedia.org/resource/Sonora_High_School_(Texas),Sonora High School (Texas),228
http://dbpedia.org/resource/Stephen_Perse_Foundation,Stephen Perse Foundation,740
http://dbpedia.org/resource/Humphrey_Perkins_School,Humphrey Perkins School,987
http://dbpedia.org/resource/Roosevelt_High_School_(Minneapolis),Roosevelt High School (Minneapolis),1228
http://dbpedia.org/resource/Cardinal_Ritter_High_School,Cardinal Ritter High School,617
http://dbpedia.org/resource/Spackenkill_High_School,Spackenkill High School,611
http://dbpedia.org/resource/Memorial_Composite_High_School,Memorial Composite High School,1208
http://dbpedia.org/resource/Georgetown_Day_School,Georgetown Day School,1183
"http://dbpedia.org/resource/Cardinal_Newman_Catholic_School,_Hove","Cardinal Newman Catholic School, Hove",3018
http://dbpedia.org/resource/Earl_Pritchett_School,Earl Pritchett School,542
http://dbpedia.org/resource/High_School_of_Dundee,High School of Dundee,1003
http://dbpedia.org/resource/Matignon_High_School,Matignon High School,388
http://dbpedia.org/resource/Wootton_Upper_School,Wootton Upper School,1162
http://dbpedia.org/resource/Bartlett_High_School_(Illinois),Bartlett High School (Illinois),2311
"http://dbpedia.org/resource/Mulberry_High_School_(Mulberry,_Florida)","Mulberry High School (Mulberry, Florida)",7
"http://dbpedia.org/resource/Oak_Grove_High_School_(Jefferson_County,_Alabama)","Oak Grove High School (Jefferson County, Alabama)",701
http://dbpedia.org/resource/St._Vincent's_C.B.S.,St. Vincent's C.B.S.,0
http://dbpedia.org/resource/Collège_du_Léman,Collège du Léman,1628
http://dbpedia.org/resource/Mundelein_High_School,Mundelein High School,2038
"http://dbpedia.org/resource/Coronado_High_School_(El_Paso,_Texas)","Coronado High School (El Paso, Texas)",3028
http://dbpedia.org/resource/Nardin_Academy,Nardin Academy,559
http://dbpedia.org/resource/Toledo_Technology_Academy,Toledo Technology Academy,175
http://dbpedia.org/resource/Foothills_Academy_(Arizona),Foothills Academy (Arizona),334
http://dbpedia.org/resource/Preston_Manor_School,Preston Manor School,1517
http://dbpedia.org/resource/Days_Creek_Charter_School,Days Creek Charter School,225
http://dbpedia.org/resource/The_Kingsway_School,The Kingsway School,1607
