http://dbpedia.org/ontology/Settlement,Settlement,http://dbpedia.org/ontology/budget
http://dbpedia.org/resource/Crawford_Central_School_District,Crawford Central School District,57814939.06375943
http://dbpedia.org/resource/Burrell_School_District,Burrell School District,27597341.508004077
http://dbpedia.org/resource/Spring_Grove_Area_School_District,Spring Grove Area School District,58769262.19649122
http://dbpedia.org/resource/Upper_Adams_School_District,Upper Adams School District,20620187.468757506
http://dbpedia.org/resource/Wayne_Highlands_School_District,Wayne Highlands School District,37813645.75306561
http://dbpedia.org/resource/Porta_Caribe,Porta Caribe,1066196.5727541246
http://dbpedia.org/resource/Millville_Area_School_District,Millville Area School District,14190506.86888514
http://dbpedia.org/resource/Department_of_Conservation_(New_Zealand),Department of Conservation (New Zealand),449879189.5215832
http://dbpedia.org/resource/Smethport_Area_School_District,Smethport Area School District,12659445.726854293
http://dbpedia.org/resource/Greenwood_School_District_(Pennsylvania),Greenwood School District (Pennsylvania),10291309.903261546
http://dbpedia.org/resource/Greenwood_School_District_(Pennsylvania),Greenwood School District (Pennsylvania),11846640.250100488
http://dbpedia.org/resource/Wyomissing_Area_School_District,Wyomissing Area School District,29526033.694222897
http://dbpedia.org/resource/Food_Standards_Scotland,Food Standards Scotland,22706570.87796448
http://dbpedia.org/resource/Carlynton_School_District,Carlynton School District,25996489.919656508
http://dbpedia.org/resource/Warrior_Run_School_District,Warrior Run School District,21316141.856152564
http://dbpedia.org/resource/Northern_Cambria_School_District,Northern Cambria School District,17368841.21847511
http://dbpedia.org/resource/Bermudian_Springs_School_District,Bermudian Springs School District,25803376.53662378
http://dbpedia.org/resource/Edgewood_School_District,Edgewood School District,2048.376725271997
http://dbpedia.org/resource/Department_for_International_Development,Department for International Development,7.903748232290583
http://dbpedia.org/resource/East_Pennsboro_Area_School_District,East Pennsboro Area School District,29468464.604246438
http://dbpedia.org/resource/Dover_Area_School_District,Dover Area School District,56419393.21987483
http://dbpedia.org/resource/Peters_Township_School_District,Peters Township School District,43429118.04162467
http://dbpedia.org/resource/Central_Dauphin_School_District,Central Dauphin School District,150833882.54682365
"http://dbpedia.org/resource/Manitoba_Culture,_Heritage_and_Tourism","Manitoba Culture, Heritage and Tourism",72816581.65551168
http://dbpedia.org/resource/Ohio_Department_of_Veterans_Services,Ohio Department of Veterans Services,74716188.21698363
http://dbpedia.org/resource/Michigan_Department_of_Agriculture_and_Rural_Development,Michigan Department of Agriculture and Rural Development,88529712.1292542
http://dbpedia.org/resource/Department_of_Treasury_and_Finance_(Victoria),Department of Treasury and Finance (Victoria),244409731.31592932
http://dbpedia.org/resource/Greencastle-Antrim_School_District,Greencastle-Antrim School District,30203838.93857668
http://dbpedia.org/resource/Dunmore_School_District,Dunmore School District,16503991.501981797
http://dbpedia.org/resource/Dallastown_Area_School_District,Dallastown Area School District,88188362.29716451
http://dbpedia.org/resource/Farrell_Area_School_District,Farrell Area School District,16336503.86932605
http://dbpedia.org/resource/Mount_Carmel_Area_School_District,Mount Carmel Area School District,18357548.00282003
http://dbpedia.org/resource/Serious_Fraud_Office_(New_Zealand),Serious Fraud Office (New Zealand),8274479.816700827
http://dbpedia.org/resource/Smethport_Area_School_District,Smethport Area School District,14599.396778493483
http://dbpedia.org/resource/Brunswick_(Brittonkill)_Central_School_District,Brunswick (Brittonkill) Central School District,23476185.777821288
http://dbpedia.org/resource/Middletown_Area_School_District,Middletown Area School District,36882040.18016876
http://dbpedia.org/resource/South_Eastern_School_District,South Eastern School District,47234483.87518636
http://dbpedia.org/resource/Ferndale_Area_School_District,Ferndale Area School District,9504024.25117956
http://dbpedia.org/resource/Wyoming_Area_School_District,Wyoming Area School District,23032979.961558156
http://dbpedia.org/resource/Halifax_Area_School_District,Halifax Area School District,17091990.2542659
http://dbpedia.org/resource/Western_Wayne_School_District,Western Wayne School District,35506562.599235624
http://dbpedia.org/resource/Connellsville_Area_School_District,Connellsville Area School District,57497168.104956456
http://dbpedia.org/resource/Ministry_of_Education_(New_Zealand),Ministry of Education (New Zealand),11770821269.122272
http://dbpedia.org/resource/East_Allegheny_School_District,East Allegheny School District,33819210.61935764
