http://dbpedia.org/ontology/Settlement,Settlement,http://dbpedia.org/ontology/budget
http://dbpedia.org/resource/Purchase_Line_School_District,Purchase Line School District,18964521.22246885
http://dbpedia.org/resource/Avonworth_School_District,Avonworth School District,23624309.06131493
http://dbpedia.org/resource/Central_Cambria_School_District,Central Cambria School District,21912484.33172927
http://dbpedia.org/resource/Foreign_and_Commonwealth_Office,Foreign and Commonwealth Office,1.052637160823279
http://dbpedia.org/resource/Wyoming_Area_School_District,Wyoming Area School District,22007725.54838753
http://dbpedia.org/resource/Altoona_Area_School_District,Altoona Area School District,86414976.54796696
http://dbpedia.org/resource/Peters_Township_School_District,Peters Township School District,48563429.85366629
http://dbpedia.org/resource/East_Pennsboro_Area_School_District,East Pennsboro Area School District,32211389.701581866
