http://dbpedia.org/ontology/EducationalInstitution,EducationalInstitution,http://dbpedia.org/ontology/budget
http://dbpedia.org/resource/Clairton_City_School_District,Clairton City School District,11462204.862894207
http://dbpedia.org/resource/Tahanto_Regional_High_School,Tahanto Regional High School,7369502.0732723735
http://dbpedia.org/resource/Federal_Judicial_Center,Federal Judicial Center,24385787.482010607
http://dbpedia.org/resource/Conewago_Valley_School_District,Conewago Valley School District,37822302.21529836
http://dbpedia.org/resource/Blackhawk_School_District,Blackhawk School District,32144072.925822552
http://dbpedia.org/resource/Hamburg_Area_School_District,Hamburg Area School District,36105306.59333788
http://dbpedia.org/resource/Sto-Rox_School_District,Sto-Rox School District,25456137.01112086
http://dbpedia.org/resource/Central_Dauphin_School_District,Central Dauphin School District,174271888.9227031
http://dbpedia.org/resource/Derry_Township_School_District,Derry Township School District,59096865.32686701
http://dbpedia.org/resource/Bald_Eagle_Area_School_District,Bald Eagle Area School District,33749362.42376187
http://dbpedia.org/resource/Harrisburg_School_District_(Pennsylvania),Harrisburg School District (Pennsylvania),123933091.61810286
http://dbpedia.org/resource/West_Middlesex_Area_School_District,West Middlesex Area School District,11365524.185127717
http://dbpedia.org/resource/Selinsgrove_Area_School_District,Selinsgrove Area School District,44266299.05185729
http://dbpedia.org/resource/Cocalico_School_District,Cocalico School District,42540848.64961212
http://dbpedia.org/resource/Mahanoy_Area_School_District,Mahanoy Area School District,15785139.041376095
http://dbpedia.org/resource/Reynolds_School_District_(Pennsylvania),Reynolds School District (Pennsylvania),15966548.784839481
http://dbpedia.org/resource/Chambersburg_Area_School_District,Chambersburg Area School District,121699903.6258835
http://dbpedia.org/resource/Monessen_City_School_District,Monessen City School District,15957649.091411287
http://dbpedia.org/resource/Mid_Valley_School_District,Mid Valley School District,16960456.001840957
http://dbpedia.org/resource/Baldwin-Whitehall_School_District,Baldwin-Whitehall School District,65671006.675967835
http://dbpedia.org/resource/Punxsutawney_Area_School_District,Punxsutawney Area School District,44445307.525970325
http://dbpedia.org/resource/Shenandoah_Valley_School_District,Shenandoah Valley School District,16026098.93037748
http://dbpedia.org/resource/West_Perry_School_District,West Perry School District,39957348.17186381
http://dbpedia.org/resource/Fannett-Metal_School_District,Fannett-Metal School District,7659813.679437514
http://dbpedia.org/resource/West_Branch_Area_School_District,West Branch Area School District,15047702.635603687
http://dbpedia.org/resource/Minersville_Area_School_District,Minersville Area School District,20393992.18214404
http://dbpedia.org/resource/West_Branch_Area_School_District,West Branch Area School District,14222854.607289506
http://dbpedia.org/resource/Oak_Hill_High_School_(Maine),Oak Hill High School (Maine),2.3507427245949812
http://dbpedia.org/resource/Littlestown_Area_School_District,Littlestown Area School District,23985888.887699675
http://dbpedia.org/resource/Wyoming_Area_School_District,Wyoming Area School District,26342461.32060453
http://dbpedia.org/resource/Tamaqua_Area_School_District,Tamaqua Area School District,28554471.63787753
http://dbpedia.org/resource/Union-Endicott_High_School,Union-Endicott High School,82278492.49817233
http://dbpedia.org/resource/Greencastle-Antrim_School_District,Greencastle-Antrim School District,30480521.131156147
http://dbpedia.org/resource/Halifax_Area_School_District,Halifax Area School District,19357446.81562067
http://dbpedia.org/resource/Line_Mountain_School_District,Line Mountain School District,15461644.191696372
http://dbpedia.org/resource/Bloomsburg_Area_School_District,Bloomsburg Area School District,24489864.45055221
http://dbpedia.org/resource/Forest_Hills_School_District,Forest Hills School District,39230515.61359427
http://dbpedia.org/resource/Chester_Upland_School_District,Chester Upland School District,120650927.37683557
http://dbpedia.org/resource/Hoosac_Valley_High_School,Hoosac Valley High School,23284551.309715904
http://dbpedia.org/resource/Derry_Township_School_District,Derry Township School District,55437621.65955978
http://dbpedia.org/resource/Lewisburg_Area_School_District,Lewisburg Area School District,29455986.036917314
http://dbpedia.org/resource/Susquehanna_Township_School_District,Susquehanna Township School District,42881503.810475424
http://dbpedia.org/resource/East_Allegheny_School_District,East Allegheny School District,34439496.686379194
http://dbpedia.org/resource/East_Pennsboro_Area_School_District,East Pennsboro Area School District,29114507.479476538
http://dbpedia.org/resource/East_Allegheny_School_District,East Allegheny School District,23330473.236960586
http://dbpedia.org/resource/Carbondale_Area_School_District,Carbondale Area School District,19919898.48779774
http://dbpedia.org/resource/Austin_Area_School_District,Austin Area School District,3624887.983356034
http://dbpedia.org/resource/Bridgewater-Raynham_Regional_High_School,Bridgewater-Raynham Regional High School,9100.816373730837
http://dbpedia.org/resource/Chartiers_Valley_School_District,Chartiers Valley School District,59438545.42735627
http://dbpedia.org/resource/Greencastle-Antrim_School_District,Greencastle-Antrim School District,39139569.88639863
http://dbpedia.org/resource/Daniel_Boone_Area_School_District,Daniel Boone Area School District,31595798.43945483
http://dbpedia.org/resource/Boys_Town_Jerusalem,Boys Town Jerusalem,7385744.60735844
http://dbpedia.org/resource/Central_York_School_District,Central York School District,78573515.29336275
http://dbpedia.org/resource/East_Allegheny_School_District,East Allegheny School District,34435173.29874937
http://dbpedia.org/resource/Bethlehem-Center_School_District,Bethlehem-Center School District,16127472.331907218
http://dbpedia.org/resource/Wyalusing_Area_School_District,Wyalusing Area School District,14502819.817736752
http://dbpedia.org/resource/Susquenita_School_District,Susquenita School District,28476462.62249087
http://dbpedia.org/resource/Montgomery_Area_School_District,Montgomery Area School District,12773488.408921594
http://dbpedia.org/resource/Blue_Mountain_School_District,Blue Mountain School District,35873570.85249463
http://dbpedia.org/resource/Sharpsville_Area_School_District,Sharpsville Area School District,12240920.271159027
http://dbpedia.org/resource/East_Pennsboro_Area_School_District,East Pennsboro Area School District,36595349.052248396
http://dbpedia.org/resource/Penns_Valley_Area_School_District,Penns Valley Area School District,22366624.665185735
http://dbpedia.org/resource/Laurel_School_District_(Pennsylvania),Laurel School District (Pennsylvania),19008660.387030017
http://dbpedia.org/resource/Towanda_Area_School_District,Towanda Area School District,21173113.189898442
http://dbpedia.org/resource/Southern_Columbia_Area_School_District,Southern Columbia Area School District,20488504.959277645
http://dbpedia.org/resource/Peters_Township_School_District,Peters Township School District,61210629.7407286
http://dbpedia.org/resource/Mifflin_County_School_District,Mifflin County School District,59468353.42647081
http://dbpedia.org/resource/Canton_Area_School_District,Canton Area School District,14422199.908497222
http://dbpedia.org/resource/Keystone_Oaks_School_District,Keystone Oaks School District,34310274.18791763
http://dbpedia.org/resource/Mount_Carmel_Area_School_District,Mount Carmel Area School District,14512689.84873294
http://dbpedia.org/resource/South_Fayette_Township_School_District,South Fayette Township School District,29776593.868479118
http://dbpedia.org/resource/Sharon_City_School_District,Sharon City School District,30404123.39056627
http://dbpedia.org/resource/Conemaugh_Valley_School_District,Conemaugh Valley School District,15373084.533647943
http://dbpedia.org/resource/Hollidaysburg_Area_School_District,Hollidaysburg Area School District,40825337.49201354
http://dbpedia.org/resource/Perkiomen_Valley_School_District,Perkiomen Valley School District,77153791.00651015
"http://dbpedia.org/resource/Central_Catholic_High_School_(Bloomington,_Illinois)","Central Catholic High School (Bloomington, Illinois)",3210203.36511212
http://dbpedia.org/resource/Monomoy_Regional_High_School,Monomoy Regional High School,29464090.558315378
http://dbpedia.org/resource/Mifflinburg_Area_School_District,Mifflinburg Area School District,22716257.65472608
http://dbpedia.org/resource/Southern_Tioga_School_District,Southern Tioga School District,27730942.28555373
http://dbpedia.org/resource/Sussex_Coast_College_Hastings,Sussex Coast College Hastings,19249965.03282178
http://dbpedia.org/resource/Milton_Area_School_District,Milton Area School District,26532306.427203067
http://dbpedia.org/resource/Central_Columbia_School_District,Central Columbia School District,27913962.53359889
http://dbpedia.org/resource/Assabet_Valley_Regional_Technical_High_School,Assabet Valley Regional Technical High School,19340430.944773808
http://dbpedia.org/resource/Wellsboro_Area_School_District,Wellsboro Area School District,22084621.815597538
http://dbpedia.org/resource/Commodore_Perry_School_District,Commodore Perry School District,8131166.443056261
http://dbpedia.org/resource/Wyalusing_Area_School_District,Wyalusing Area School District,15173436.542369055
http://dbpedia.org/resource/Loyalsock_Township_School_District,Loyalsock Township School District,22091794.150864676
http://dbpedia.org/resource/Kane_Area_School_District,Kane Area School District,16980887.909892797
http://dbpedia.org/resource/Greenwood_College,Greenwood College,11709132.771110814
http://dbpedia.org/resource/Cocalico_School_District,Cocalico School District,43649413.98798811
http://dbpedia.org/resource/East_Pennsboro_Area_School_District,East Pennsboro Area School District,32285782.118602343
